UniqueID,Contributor,Premium User,Date,Time,Comment,Child
f6f4fa06-5d18-4b53-b673-8ba47b70a7e9,Bulgroz,True,2021-09-24,13:53:42.000Z,"Je pense que vous avez noté que Mélenchon passait son temps à noter et a m^me fait une crise parce qu'il avait perdu son stylo (quand on est prévoyant et on veut écrire, on aen a un autre en réserve&nbsp;!).<br>Zemmour a juste consulté brièvement son téléphone où il recevait sans doute des conseils de son équipe...<br>Qui est le has-been rétrograde&nbsp;? Pas celui qui se prétend le phare du modernisme...",0
399bff2c-e9b6-4ec2-9293-04c19bf9e237,Caroline Avenier,False,2021-09-24,13:53:03.000Z,Zemmour la machine à perdre de Marine et donc l'atout majeur de Macron.,0
a84a927d-d603-4c03-89a5-6d37d101c2ad,Mickey Lange,False,2021-09-24,13:51:23.000Z,Mini-battle d'égos pour gogos.,0
3acbecf5-373a-4672-8ea5-1839d9e3ee81,denis2017,False,2021-09-24,13:50:20.000Z,Finalement c’est assez simple: pour Mélenchon tous les problèmes de la France (et du monde) viennent du capitalisme; pour Zemmour tous les problèmes de la France (et du monde) vienne de l’Islam. Pas la peine d’y passer 2 heures.,0
062b5813-d3fd-4272-ba68-2e33920da39a,Knudsenisback,False,2021-09-24,13:47:25.000Z,"Zemmour parle de redresser la France, je lui suggère déjà de redresser son dos, quelle mauvaise posture il était complétement replié sur lui. Et je ne parle pas du pianotage de smartphone très impolie, ou sa façon de parler a la journaliste, imagine t on un seul instant ce comportement d'un président&nbsp;? Ceux critiquant sans cesse macron sur la posture presidentiel peuvent critiquer Zemmour pour le coup. Ce n'est que la forme mais pour un président la forme compte. Sur le fond, zemmour pense qu'en suspendant les sanctions de la Russie (ce qu'il ne pourra pas faire car décision européenne) poutine va lui faire des faveurs, quelle naïveté&nbsp;!",0
f0350473-d942-4933-b132-16304ce2c789,11.19.51.02,False,2021-09-24,13:47:22.000Z,"Melanchon est un grossier personnage qui ne rêve que de 1789 et de redécapiter le roi comme en 1798 mais il a oublié qu'en 1799 un consulat voyait apparaitre un certain Napoléon qui laissera des traces glorieuses en notre pays .Merlanchon , par ses invectives ,son manque de respect pour son adversaire a montré ainsi ce qu'il serait en tant que chef de l'état&nbsp;:un petit Staline auquel il n'est pas bon de résister .",0
e4202699-64d8-424d-824f-a2797e14d1fe,Rackham-le-Bleu,True,2021-09-24,13:47:15.000Z,"Créolisation... Primo les créoles ne sont pas musulmans. Secundo, même comme ça ce n'est pas un modèle.",0
741513ea-5f5f-420b-baac-d012f5122c00,Le canard looké,False,2021-09-24,13:46:20.000Z,"Mélanchon, quand le voyons-nous à la plage avec une belle femme, une créole? Il faut qu'il soit crédible!",0
6903f908-ab3f-4cca-a27a-bec2ef550f79,yepheth,False,2021-09-24,13:45:56.000Z,Quelle honte chers compatriotes quelle honte chez Pascal Praud ce matin quand celui-ci fait part de son émoi devant des femmes qui se baignaient en burkini sur une plage bretonne et qu’il se pose des questions sur la France le représentant je dis bien le représentant de la France insoumise dit « de toute façon vous n’êtes pas prêt pour discuter du Burkini « la France insoumise acte le fait que les femmes peuvent aller se baigner en Burkini&nbsp;»<br>Et il ose dire en plus tenez vous bien « mais avant ces femmes elles existaient mais vous ne les voyiez pas elles n’avaient pas le droit d’aller se baigner&nbsp;»!.<br>Vous imaginez une femme de 30 ans qui n’a pas le droit d’aller se baigner et le type vous raconte ça sur un plateau télé et Zemmour est un danger pour la démocratie.??<br>Non mais je rêve il est l’en train de justifier que dans un pays soi-disant laïque avec égalité homme femme on interdit à une femme d’aller se baigner sous prétexte de religion.<br>Plutôt que de de dire on va se battre et on va imposer par la force s’il faut les lois de la république on préfère abdiquer et dire bien soit alors allons faire la charia simplement ce que personne ne dit c’est que le jour où il n’y aura plus trois femmes ou quatre femmes mais 100 ou 200 femmes en Burkini sur une plage celles qui se présenteront en maillot de bain se sentiront mal à l’aise et de risque d’être insultées bon sang ouvrez les yeux et voter correctement Zemmour en 2022 merci,0
ef9e4b3f-755b-4d1b-bd9f-1f89b3562b29,Gilles et Had,False,2021-09-24,13:45:41.000Z,"Zemmour s'est fait corriger, sur la forme et en grande partie sur le fond par un Mélenchon de mauvaise foi comme toujours mais en grande forme, il n'a ni les épaules ni l'envergure des ambitions qu'on lui prête&nbsp;: un Lepen rétréci, diminué, mono maniaque er dépressif",0
c2007d0d-79eb-4591-b0d7-c1d13c7e2555,carla parma,False,2021-09-24,12:46:26.000Z,"Monsieur Zemmour, quel plaisir j'ai pris à vous écouter.",0
5ffb280d-61c9-483d-a8ba-405c6b849de8,4074337 (profil non modéré),False,2021-09-24,12:45:35.000Z,"J'ai assisté à un combat de 2 coq séniles se disputant le monopole de la connaissance historique en faisant croire ""au peuple"" que leur projet pour l'avenir de la France est le seul et le meilleur, ânonnant et ressassant depuis 30 ans et dans leur bac à sable respectif, leurs mêmes petites histoires revues et corrigées de l'histoire Française.",0
1b9bec93-d905-47bc-9f13-17e402a72215,anonyme,False,2021-09-24,12:44:53.000Z,Même niveau que le débat Tapi-Le Pen d'il y a 30 ans.,0
2c084b89-aa35-4460-8e2b-3e2a4be085bc,olrzsl,True,2021-09-24,12:44:06.000Z,"Dette de la ville de Paris: 7,7millards d'euros.<br>Evacuation des jardins d'Eole des addicts au crack pour les déplacer à côté . Procès de la tuerie du Bataclan.<br>Voici l'actualité du jour pour Paris. Près de Lille on a assassiné un homme de 70 ans durant un cambriolage pour 700€.<br>A lire certains commentaires et certaines réactions, j'ai l'impression que beaucoup de gens résident dans des petites villes, bien tranquilles, dans lesquelles on peut vivre la porte ouverte. Vous avez beaucoup de chance. Profitez en bien car le ""Zemouristan"", malheureusement, est un modèle urbain qui se développe...",0
10b17f87-d1a6-4b6f-9b39-6395b26aa374,ca18,True,2021-09-24,12:43:15.000Z,"Les lois de la République, votées par la représentation nationale dûment élue par le peuple français, ne sont PAS négociables.",0
c7dcbf9e-eab3-462a-bfed-bee7348fa034,Marre de cette mascarade,False,2021-09-24,12:42:15.000Z,"Vu le niveau des avaleurs de couleuvres d'extrême droite, Zemmour peut inventer tous les chiffres et promettre n'importe quoi.",0
9a862891-4fdf-40cb-9469-0c377f59e2e4,yorick,False,2021-09-24,12:41:16.000Z,"Alternant arrogance, vociférations et lyrisme de pacotille, Mélenchon s'est complètement ridiculisé.<br>A l'inverse, Zemmour, calme, courtois, parfois ironique mais toujours maître de lui, a dominé le débat et a su judicieusement placer ses arguments.<br>Décidément, cette campagne présidentielle, qui promettait d'être terne et sans surprise, commence à devenir intéressante.",0
d08c43fb-2131-4850-8840-02021a74f6a0,Iscyros,True,2021-09-24,12:40:37.000Z,"La créolisation n'est pas un processus heureux et égalitaire, et sur ce sujet Mélenchon lui-même est dépassé sur sa gauche car pas assez légitime. Il n'est jamais arrivée qu'une nation renonce à sa puissance pour capituler même culturellement en se retrouvant perdant économiquement.",0
1f7f1f75-f279-4b23-a818-61039ee9823f,anonyme 49097,True,2021-09-24,12:40:29.000Z,Mélenchon&nbsp;: Mauvaises diagnostiques ; mauvaises solutions&nbsp;!<br>Zemmour&nbsp;: Bonne diagnostiques ; peu de solutions&nbsp;!,0
a771f6af-c8c2-436f-b903-71966365c746,ROSITA 4,False,2021-09-24,12:12:05.000Z,"Zemmour pour s'être adressé d'une façon aussi discourtoise prouve le mépris envers les femmes et pourtant ...s'en sert quand cela lui convient , suffisemment de photos pour l'illustrer.....",0
74c4ec59-6306-42a0-b15c-14e07199b331,lizardking,True,2021-09-24,12:11:49.000Z,"c’était le premier et le dernier vrai débat d’idées. La suite ne sera qu’enfilage de perles, ouverture de porte ouverte. Le plus centriste gagnera par un usage abusif du politiquement correct. Il n’y a qu’une liberté, rien qu’une: c’est de voir clair d’abord, et puis ensuite d’avoir du pognon plein les poches, le reste c’est du mou! Les français doivent s’attacher à cette citation de Céline, ce sera leur salut.",0
44afe6ac-6c97-4fa8-aad3-b97fd5cd3520,jptal001,False,2021-09-24,12:10:02.000Z,"Soyons sérieux quelques instants&nbsp;! vous ne pouvez pas comparer un homme d'Etat comme Mélenchon avec un guignol comme Zemmour&nbsp;? rien que sur les pourcentages d'avis favorables les journalistes d'aujourd'hui s'extasient sur les 11% de Zemmour, c'est un peu vite oublier que Coluche en 1981 ralliait 16% d'intention de vote, chut ...! il ne faut pas le rappeler....? ben oui quoi&nbsp;! je suis de plus en plus persuadé que Zemmour travaille soit pour Macron soit pour Bertrand avec à la clé une place de choix dans le futur gouvernement.",0
a0595669-549e-4675-97ff-659cad4f8baa,anonyme,False,2021-09-24,12:06:48.000Z,Il faudra un jour que quelqu'un m'explique pourquoi l'extrême droite n'est même pas foutue d'écrire correctement le nom de Mélenchon et pourquoi ils écrivent tous Mélanchon... AL.,0
df631651-3bb9-4ab8-a91a-6787c72d503f,Dany L,False,2021-09-24,12:06:39.000Z,"Comment défendre "" la créolisation "" du pays sans être assigné devant un tribunal?",0
b1944efd-f7f5-4d03-9bf5-1f52c8aabf0e,bastok64,True,2021-09-24,12:06:11.000Z,"Un Mélenchon vieilli,dépassé, faisant des dessins sur ses notes, se faisant répéter les questions, n'écoutant parfois personne, cherchant son stylo par terre...ç'est ça le fameux leader pour 2022&nbsp;? sérieux, il n'y a plus que son staff pour le défendre... En face un Zemmour flamboyant, passible, lucide, fidèle a ses idées, décochant ses vérités et ses analyses irréfutables. Une fois qu'il sera entouré de spécialistes en chaque domaine, il apportera une Vision pour la France digne de ces 2 mots&nbsp;: Vision, France. Enfin, bravo pour BFM, ils auront été les premiers à ""saisir et comprendre"" que l'avenir pour la politique de notre pays, ç'est Zemmour&nbsp;! Et surtout pas les éoliennes, les usines à charbon, ou les futures inondations de Bordeaux ou d'ailleurs, notamment du """"Melanchonistan"""". Ce dernier étant déjà en train de couler.... Par contre il faudrait tout de même que le patron de BFM, pourtant un pro des débats, M. Fogiel, ose mettre des animateurs faisant le poids pour ce genre de débats, ceux d'hier au soir furent les seuls points faibles de la soirée...",0
5a459512-e266-491d-9a84-c97d65d274ca,Obélix 59,False,2021-09-24,12:05:44.000Z,"Trop rigolo le mélanchon ..;Sur les sujets qui le fâchent, ou bien il invective , ou bien il prend des notes , caché derrière ses lunettes...",0
bb944dba-215f-465b-90cf-a41dcbdce0aa,anonyme,False,2021-09-24,12:04:03.000Z,Eric Zemmour ne s'est pas laissé démonter par les propos injurieux et la hargne de Mélenchon. Un débat pas facile mais intéressant. Eric Zemmour à gagner sa place en politique.,0
4930faa3-e3dc-44cc-9cdb-272f091c5531,Duxbellorum,False,2021-09-24,12:03:41.000Z,"Zemmour a sérieusement besoin d'une consultation psy, son obsession de l'islam est pathologique. Quant à Mélenchon ben c'est Mélenchon&nbsp;!",0
610f7189-face-48d9-a06b-46c561992d0e,Gilou,False,2021-09-24,12:27:31.000Z,"Quel bien mauvais résumé de la part de Zemmour, obsédé qu'il est par l'immigration&nbsp;: ""Lui, il veut sauver la planète. Moi, je suis beaucoup plus modeste que lui, je veux uniquement sauver la France""...<br>Mélenchon ne veut pas sauver la planète, il veut juste piquer des voix aux écolos.<br>Une fois élu, Mélenchon serait plus pressé de collectiviser l'économie que de sauver la planète&nbsp;!",0
c2036f22-016b-498c-8d43-8b8fb859dd3d,Codex85,True,2021-09-24,12:26:25.000Z,Madame Fast checking était complètement à la rue. Son 1 milliard de fraude aux prestations sociales versus les 30 milliars annoncés par Charles Prats est une blague. Zemmour à bien fait de la tacler.,0
8012f7ae-6d1c-4e18-941c-d92c81b70233,Senji,True,2021-09-24,12:22:03.000Z,"Un chiffre intéressant a été cité hier par Zemmour, intéressant mais malheureusement pas débattu: parmi les 400 mille nouveaux arrivants tous les ans, seulement 14% viennent pour travailler. Il serait instructif de faire une étude sur les revenus des autres 86%. Vivent-ils tous au crochet de la République?",0
36a186c6-6b2d-4062-9df7-32ad6c5b8867,ca18,True,2021-09-24,12:19:53.000Z,"Petit rappel factuel&nbsp;:<br>Le mot « islam&nbsp;» est la translittération de l'arabe الإسلام, islām, signifiant&nbsp;: « la soumission et la sujétion aux ordres de Dieu&nbsp;».<br>Tout est dit. Cette religion a pour objectif de régir à la fois le spirituel ET le temporel.<br>Il est grand temps de réagir.",0
f5613121-e32e-4ae9-8af7-4ad1d37f405b,Dupont thé,False,2021-09-24,12:18:46.000Z,"Zemmour, c'est simple, c'est l'homme qui aurait aimé vivre sous Napoléon 1er, sans doute comme Maréchal ( nous voilà&nbsp;!) et qui se serait suicidé après Waterloo...Ou finir à Sainte Hélène.",0
59cd6bb6-470b-429b-b55b-c00ea35374f5,Senji,True,2021-09-24,12:18:15.000Z,"Si Zemmour a du succès, c'est parce que les politiques de tout bord ont complètement abandonné les thèmes de nation, d'identité et d'insécurité. Même le RN fait profil bas, pour ne pas se faire qualifier ""d'extrême-droite"". Or ce sont des sujet de société d'une énorme importance, et on doit en parler sans se cacher derrière son petit doigt. Zemmour apporte des arguments au débat, mais se heurte à des dizaines d'années de conditionnement de la classe médiatique.",0
6f5e2084-d06e-4d12-bbf1-f71ac44c7943,Knudsenisback,False,2021-09-24,12:17:53.000Z,"sur quelles bases diplomatiques Zemmour va il persuader Poutine de s'allier a lui? Et ça c'est 1 des centaines de questions sans reponses suite a son intervention, le flou artistique sur les propositions",0
a739903f-85d0-4f1f-900d-05ff28271d7a,ca18,True,2021-09-24,12:17:46.000Z,"« 74 % des Français musulmans de moins de 25 ans affirment mettre l'islam avant la République&nbsp;», selon un sondage Ifop. (Le Figaro - 8 sept. 2020)<br>On ne transige pas avec les lois de la République Française&nbsp;!",0
78795c87-8b4a-40c9-97b6-1111edccfc14,Le Gaga de Sainté,False,2021-09-24,12:16:19.000Z,Confirmation qu’aucun des 2 n’a la stature présidentielle! Et pour Mélenchon l’heure de la retraite est plus que confirmée….,0
10fab83b-4648-4a9c-aff7-82422a0b8cc4,Grava,False,2021-09-24,12:13:27.000Z,Mélenchon a été laminé par Zemmour qui n'avait aucun papier sur le pupitre alors que Mélenchon en avait 5cm d'épaisseur et ne faisait que noter.,0
4028a583-c08e-4669-8d0c-65e9efacb9e9,Berjidet,False,2021-09-24,12:38:59.000Z,Il me semble que el Melenchon a fait un rajeunissement facial avec traitement esthétique de la denture. Surtout il a fait d’énormes progrès pour ne pas montrer un visage haineux&nbsp;!,0
681ec581-c92c-43b8-9279-8813272bd95c,pop003,False,2021-09-24,12:03:27.000Z,"Pour Zemmour ne se déclare t'il pas&nbsp;? il y a une raison: Zemmour prend autour de 10% des voix à Le Pen. De plus, il y aura sûrement un ou plusieurs autres candidats d'extrême droite ou de droite extrême: Poisson, Dupont Aignan, etc. qui prennent également des voix dans le même vivier. Enfin, le LR le plus à droite sera probablement élu aux primaires de la droite, prenant potentiellement des voix dans les parages. Et donc, Le Pen a une peur extrême de ne pas arriver au second tour. Zemmour ne se déclare pas pour faire monter les enchères, il attend un gros chèque pour se retirer, que les Russes, protecteurs de MLP, n'ont toujours pas signé à ce jour.",0
989dde43-a24f-4182-90cb-e2fbb584d800,ca18,True,2021-09-24,12:37:10.000Z,"On attend toujours la dissolution par Darmanin des fédérations qui ont refusé de signer la fameuse Charte de Macron sur l'islam de France, puisqu'on a désormais clairement la preuve qu'elles ont refusé de s'inscrire explicitement dans les lois démocratiques de notre République.<br>Cette Charte inclut en effet (notamment) l'égalité homme/femme, le droit à l'apostasie et la primauté des lois républicaines.",0
75013088-9b31-4b88-875a-a0e23d10ee86,clo,True,2021-09-24,12:35:37.000Z,"Zemmour a été très bon, Melenchon a été bon .",0
c2ce2792-78a2-4318-84eb-c060991bbf05,,False,2021-09-24,12:35:22.000Z,"Il est temps d’arrêter les divisions dans le camp souverainiste et patriote&nbsp;! Une alliance Le Pen, Zemmour, Philippot, Marion Maréchal avec le soutien de Poutine pourrait gagner les élections législatives&nbsp;!",0
3332d7f9-ad25-4523-a44e-fc844715da56,antoine230,True,2021-09-24,12:35:10.000Z,"""Fin du monde"" contre ""Fin de la France"". Les deux ont été solides, avec une avance de Zemmour tout de même. Mais les deux sont assez anxiogènes et leurs propos théoriques. Un peu de positivité et de pragmatisme pour embarquer les français seraient le bienvenu s'ils veulent percer.",0
ffa63f12-62eb-432a-9425-ef16c216bcd5,jj47,False,2021-09-24,12:32:57.000Z,"Zemmour n'a aucune envergure. Il est recroqueville sur lui même, tout comme sa pensée. Il n'a pas l'épaisseur d'un homme politique . Quant au programme, c'est un peu mince, les arabes dehors, pour diriger la France. Et ce genre de politique mene toujours à la catastrophe. Finalement, il incarne un certain déclin intellectuel français, par sa pensée minimaliste, qu'il entend dénoncer .<br>Je suis étonné que des gens avertis de droite, mise sur ce mauvais cheval.",0
19c88fe4-6f71-49d5-8fce-d4ed971c0f06,,False,2021-09-24,12:32:34.000Z,Macron remercie chaleureusement Zemmour et Mélenchon pour cette excellente soirée!,0
1c998b67-b3f9-4722-a0cb-89dcd14f5c34,trollhébus,False,2021-09-24,12:31:00.000Z,Au vu du débat je trouve zemmour clairement anti musulman et anti Africains.,0
9e47fc94-05de-46d0-8f62-44e876d2ba93,dudule14,False,2021-09-24,12:30:28.000Z,sans intérêt les 2 vont faire 5 % en 2022,0
7ab53cf5-0030-490c-9572-3b95b978e26d,Cyprinis,False,2021-09-24,12:29:23.000Z,"Je ne suis ni melenchoniste ni zemmouriste. Néanmoins j'ai apprécié ce débat parfois houleux voire hargneux de ces 2 là. Intéressant et parfois savoureux, j'ai parfois eu l'impression d'être au spectacle. Mélenchon m'est apparu un peu vieilli et avec de tps à autre une difficulté à se concentrer",0
83e9ae54-de99-4313-8e21-4ddab82c6cae,Mouais59,False,2021-09-24,12:29:08.000Z,"Entre un castriste et un pétainiste, match nul&nbsp;? Ben oui, nul, complètement nul&nbsp;!",0
67aa4e4a-7fc2-4dbe-8b71-d64ffaba0697,garrincha,False,2021-09-24,13:09:51.000Z,"Quand je lis les commentaires des Marxistes LR, PS et LREM du figaro, je me dis que la campagne que va être longue et que les slogans et formules de tous poils, vont fuser, afin qu'ils préservent leurs idéologie gauchiste.",0
b3e547ea-bc78-404f-baae-97b314dfa975,Lou Clapas,False,2021-09-24,13:08:14.000Z,Débat nul de bout en bout.,0
153bd9b5-40a3-4a65-87b3-187e6e6f76e2,Psychelau,False,2021-09-24,13:01:35.000Z,Zemmour sur l environnement.... le vide...,0
945ee988-1b90-4dca-8bb6-88c3db19a7ea,Arcusgi,True,2021-09-24,12:59:21.000Z,"Les musulmans en France doivent être français, républicain et enfin musulman. La religion doit rester dans la sphère privée, être discrète et ne pas se mêler des affaires de la Cité. Le rejet intervient quand on constate qu'une majorité de jeunes musulmans placent la charia avant les lois de la République, qu'ils combattent ses symboles et qu'ils créent leur propres domaines indépendant de la Nation. C'est d'abord aux français musulmans de contrôler leurs extrêmes.",0
439d7cbc-4baa-4f50-bee8-b3a2b84c16af,—Corsu77–,True,2021-09-24,12:59:14.000Z,"Monsieur Zemmour dit vrai sur beaucoup de points. Néanmoins, dans notre France actuelle toutes les vérités ne sont pas bonnes à dire. Vous le savez sans doute mais vous allez passer pour un raciste.",0
3bd0e269-2926-4e1f-9218-c460faafb9ca,ca18,True,2021-09-24,12:57:42.000Z,"Allons au bout de la logique concernant la notion de racisme (définition - rappel&nbsp;: cela qualifie l'atteinte aux personnes en fonction de leur race/ethnie, de leur origine, de leurs croyances...) Vu ce qu'il est écrit dans certaines sourates sur les juifs et les chrétiens, il serait donc judicieux de considérer aussi le Coran comme tombant sous le coup de la loi. C'est parfaitement factuel.",0
40de51e1-d7e3-414b-935f-c2ac14b84ee2,dalma,False,2021-09-24,12:50:11.000Z,"Je ne dirais même pas que Mélenchon est dépassé car peu de gens ont vraiment envie ne serait-ce que de le rejoindre&nbsp;! Son passé, ses compromissions - toujours d'actualité - avec les plus grands criminels de l'Histoire, les communistes, ne donnent vraiment pas envie de le côtoyer ; perdu dans ses papiers, sans cesse en train d'écrire de peur d'oublier ce qu'il a à dire&nbsp;! De l'autre côté, Zemmour, impérial, jamais pris en défaut, son bureau pas encombré de feuilles et de notes dont il n'a pas besoin, ayant tout dans la tête, à l'aise sur tous les sujets, a survolé le débat.",0
3f38e0bc-dc41-4541-a10e-5404458ba356,Psychelau,False,2021-09-24,12:49:13.000Z,Zemmour n a rien a dire sur l environnement...,0
ff838789-e3bf-43be-9487-38dc4d81e5c4,trollhébus,False,2021-09-24,12:47:55.000Z,"Les harkis et leurs descendants sont pour leur immense majorité musulmans et portent des prénoms de l'islam, qu'en disent zemmour et ses soutiens?",0
758beda4-1a8b-4c65-865f-f556060fbe61,,False,2021-09-24,12:47:24.000Z,"Alcide KORPANOFF a trouvé le passage fort amusant quand MELENCHON l'islamo-gauchiste a perdu son stylo qu'il utilisait sur ses bouts de papier comme un laborieux qu'il est, ce face au brillant intellectuel écrivain et essayiste qui n'avait aucun papier devant lui .",0
31e29e37-314e-408b-ad5f-2fdb530a241a,,False,2021-09-24,13:44:14.000Z,Finalement Zemmour n’est pas aussi moche que ça&nbsp;?,0
5db6f8d3-f481-4976-907a-64e6565db12d,Réalismic,False,2021-09-24,13:44:07.000Z,Ca c'est des candidats à la présidentielle qui s'y vont avec des sous marine...,0
42badc47-e7f9-47b2-b867-32134f6f638c,,False,2021-09-24,13:43:01.000Z,Le maréchal n’aurait jamais accepté de fréquenter une ashkénaze&nbsp;! Vive la France&nbsp;! Non à Macron non à Rothschild!,0
eedc44fa-859e-4b2e-8873-44006d9297b4,MICHEL DUBOIS 33,True,2021-09-24,13:42:52.000Z,"Suite...<br>Vous avez l'air sympa vous, me dit il c'est pas comme les autres qui nous regardent en chien de faïence, vous ne devez pas être d'ici; en fait, je réponds, je viens de province en déplacement pro. Il enchaîne,"" nous, nous sommes algériens, on vit ici pour le business, vous avez été chez nous, maintenant tout çà c'est fini&nbsp;!! C'est à notre tour et maintenant ici c'est chez nous, vous allez dégager&nbsp;!""<br>Ah bon lui dit je et pourquoi&nbsp;? parce qu'on va être les Maîtres&nbsp;!!<br>Le train arrivait en gare d'Enghien ville bourgeoise avec le 1er Casino européen en CA, sur l'esplanade devant le lac, les bancs étaient occupés par des familles d'origine étrangère en majorité, les femmes plutôt voilées... à deux pas, la ville d'Epinay sur Seine, quelques centaines de mètres, les quartiers HLM tous proches, ne tentez pas de vous promener à pied sans objet car vous ne serez pas les bienvenus...on vous le fera savoir, ""c'est une zone de Business...""<br>A bon entendeur... Salut, essayez, rien ne vaut l'expérimentation, peut-être alors comprendrez vous ce que dit E.Zemmour&nbsp;! Possible&nbsp;!! ou alors vous leur ferez le plaidoyer alla J.L.Mélenchon, ils seront tout ouïe et d'emblé acquis à votre cause, j'en suis persuadé ... pour vous&nbsp;!",0
b28cf899-278a-4d89-a4aa-0add6fd539d4,Tellmemore,False,2021-09-24,13:41:18.000Z,"Vu le nombre de commentaires, il y a de l'intérêt ... On sort des discours des politiques, bien policés, pour des approches bien ancrées dans le réel. Ouf, on respire à nouveau&nbsp;!",0
4e284a20-148c-4935-8c3a-895680a2fe61,Pragmatique,False,2021-09-24,13:41:02.000Z,"En résumé, Mélenchon veut détruire la France et les français, tandis que Zemmour veut sauver la France et les français. Mélenchon est l'un des pires exemples de ce qui existe en politique&nbsp;!",0
94eb0b32-d334-44ba-8162-79ebe3c61e23,François Frane,False,2021-09-24,13:39:38.000Z,Zemmour ment. La policière avait reçue des coups de couteau.,0
ece16e8f-c31b-415e-932a-bfa33a295dbc,Pragmatique,False,2021-09-24,13:37:41.000Z,"En résumé, Mélenchon veut détruire la France et les français, tandis que Zemmour veut sauver la France et les français. Mélenchon est parmi ce qui se fait de pire en politique&nbsp;!",0
0bc42cf6-ec08-46f2-9081-c19764d2ddcc,PetitVoyagueur,True,2021-09-24,13:35:29.000Z,"Vive l Islam, vive l immigration, vive tout. Non à meluche. Non à desamour",0
819701b9-57af-4bdd-bfb8-b2a5bed36c2a,angal,True,2021-09-24,13:32:25.000Z,"comment deux descendants de migrants peuvent-ils dire ce qu'est l'identité française avec certitude, chacun son mirage en fonction de ses obsessions",0
4ab2da34-0ef6-4665-a088-07bc5aba50a5,ciubot,False,2021-09-24,13:30:54.000Z,"Melench a pu développer brillamment tous ses fantasmes: créolisation,apocalypse écologique,misère généralisée,C est le privilège des utopistes.En face, Z a paru terne, terne comme le réel.",0
