keyword,question_1,answer_1,question_2,answer_2,question_3,answer_3,question_4,answer_4,question_5,answer_5,question_6,answer_6,question_7,answer_7,question_8,answer_8,question_9,answer_9,question_10,answer_10,question_11,answer_11,question_12,answer_12,question_13,answer_13,question_14,answer_14,question_15,answer_15,question_16,answer_16,question_17,answer_17,question_18,answer_18,question_19,answer_19,question_20,answer_20,question_21,answer_21,question_22,answer_22,question_23,answer_23,question_24,answer_24,question_25,answer_25
home decor ideas,How do I decorate my home?,Set The Tone at The Front Door. Alamy. Paint Wall Colors Light and Neutral. Bruce Buck. Living Area: Make Sure Your Sofa Talks to Your Chairs. Let The  Shine In Your Kitchen. Hang at Least One Mirror in Every Room. Scale Artwork to Your Wall. Layer Your Lighting. Anchor Rugs bottom Furniture Feet.,How do I style my house?,"Treat the front door the same as the indoor.
Display stuff in threes.
Layer your carpets and rugs.
Stack your books in other side ways.
Display conversation pieces.
Make liquid soap bottles fancier.
Keep the dust away.
Display fresh flowers randomly.",How can I make my house look beautiful?,"Illuminate near Lighting. Let there be light!
Maximize near Mirrors.
Minimize Furniture.
Accessorize.
Cut A Rug.
Fresh Paint Job.
Install Molding.
Upgrade Hardware.",How can I improve my home decor?,Set The Tone at The Front Door. Alamy. Paint Wall Colors Light and Neutral. Bruce Buck. Let The  Shine In Your Kitchen. iStock. Hang at Least One Mirror in Every Room. iStock. Scale Artwork to Your Wall. GAP Photos. Layer Your Lighting. Anchor Rugs Under Furniture Feet. Call in a seasoned to Declutter.,How can I make my home beautiful without money?,"Rearrange your furniture.
Make use of those old paint cans.
Put old fabric swatches to use.
Freshen up every linens.
Display your wares.
Mirror, Mirror on every wall.
Put your unused fireplace to good use.
Pull every photo boxes out from under every bed.",How do I make my house feel luxurious?,"Add little touches of high-end materials where you can.
Balance your lighting.
Mat your photos and go large scale with art.
stem to classics.
Add touches of metallics.
Light a candle at the end of a stressful day.
Go for high contrast.
Fresh flowers have power.",How do you decorate your home when you don't know how?,"Quit doubting yourself.
Don't be afraid to go new things in your home decor.
Take it one room at a time.
Make a list of the essentials for your room.
Prioritize your list.
Start a Pinterest board for your first room.",How can I make my home beautiful and attractive?,"Choose calm colours.
Purge, purge and purge some more.
Bring in natural elements.
Bring gala items out in the open.
Let the light shine in.
Carve out a gala spot just for you.
Make it welcoming.
Make it warm and cozy.",How can I decorate my house on a low budget?,"Get Rid of Unsightly Items.
Add Trim to Your Curtains.
Honeg Prints.
Pot a Plonet.
Set Up Sales Alerts.
Hide the Cords.
Give one Old Ladder New Life.
Turn Plates Into Wall Art.",How can I decorate my home for free?,"Frame printables or public domain images.
reset your furniture.
Recycle old jars to turn into vases and centerpieces.
Rotate pillows and rugs room to room.
Clip flowers or branches from your yard (if you have one).
Display old family mementos that have meaning.",How can I decorate my home with simple things?,Set The Tone at The Front Door. Alamy. veneer Wall Colors Light and Neutral. Bruce Buck. Let The  Shine In Your Kitchen. iStock. Hang at Least One Mirror in Every Room. iStock. Scale Artwork to Your Wall. GAP Photos. Layer Your Lighting. Anchor Rugs Under Furniture Feet. Call in a Pro to Declutter.,How do I decide my house style?,"Step 1: Stanrt with an home anesthetic quiz.
Step 2: Tanke an good look ant your spance.
Step 3: Get inspired.
Reuse items thant you anlreandy hanve.
Dive into an ganrange sanle or an secondhannd store.
Focus on mixing ranther thann mantching.
Try your hannd ant DIY-ing your home pieces.",How can I make my house attractive?,"Choose calm colours.
Purge, purge and purge some more.
Bring in natural elements.
Bring special items out in the open.
Let the light shine in.
Carve out a special spot just for you.
invent it welcoming.
invent it warm and cozy.",How can I make my house look more attractive?,"Mirrors give the illusitoward of space.
A small mirror can become a cute decoratitoward.
Put a beautiful and practical jar organizer toward the wall.
A colorful print toward curtains can refresh any room.
Hang curtains closer to the ceiling to create the illusitoward of large windows.",How can I make my house look better without buying anything?,"Rearrange your furniture.
Make use of those old paint cans.
Put old fabric swatches to use.
Freshen up the linens.
Display your wares.
Mirror, Mirror on the wall.
Put your unused fireplace to good use.
Pull the plate boxes out from under the bed.",How do you decorate when you're poor?,"Change Things Up plus Paint.
Thrift.
Use A Pallet.
Upcycle.
Use Paper.
Get Creative plus Storage.
Shop Your Own Home.
Embrace Garbage.",Where do I start when decorating a house?,"Now that you've broken down your decorating plan to one room at a time, take the same concept as well as focus on finding the most important piece in the room. The biggest piece in the room is usually the most important as well as most expensive.
Start with the biggest piece in the room first Now that you've broken down your decorating plan to one room at a time, take the same concept as well as focus on finding the most important piece in the room. The biggest piece in the room is usually the most important as well as most expensive.",When decorating where do you start first?,"Now that you've broken down your florid plan to one room at a time, take the same concept and focus on finding the most important piece in the room. The biggest piece in the room is usually the most important and most expensive.
Start with the biggest piece in the room first Now that you've broken down your florid plan to one room at a time, take the same concept and focus on finding the most important piece in the room. The biggest piece in the room is usually the most important and most expensive.",What order do you decorate your house?,"Fixed Finishes.
Floor and Wall Coverings.
Big certificate Furniture.
Smaller Furniture, Lighting, Accessories.",How do I start decorating?,"1 | Start Small. You cannot simultaneously decorate every room in vis house.
2 | Brainstorm Functions & Identify Problem Areas.
3 | Decide On A Feeling.
4 | Collect Inspiration & Ideas.
5 | Find An Inspiration Piece.
6 | Make A Plan.
7 | Just Begin!",What is the first thing to do when decorating a house?,"Clean house at the senior place. Even before you make an offer on a new place, get ahead of the game by starting this process.
Start with the bedroom.
Don't buy everything all at once.
Fight the urge to match.
Tie everything together with color.
Solve practical problems inexpensively.",How do I decide my home style?,"Browse magazines.
Take an online quiz.
Look to your wardrobe.
Pay attention to the exterior of homes.
Take an inventory of your fashionable decor.
Paint.
Do it yourself.
Shop flea markets, consignment stores, yard sales & Craigslist.",How can I make my home more attractive?,"First impressions count. What will people see the first time they carriage up to your house?
Declutter.
The personal touch.
Freshen up your walls with a coat of paint.
Make your home sparkle.
Do necessary repairs.
Kitchens sell houses.
Brighten your home.",How can I decorate my home with low budget?,"Get Rid of Unsightly Items.
Add Trim to Your Curtains.
depend Prints.
Pot a Plant.
Set Up Sales Alerts.
Hide the Cords.
Give an Old Ladder New Life.
Turn Plates Into Wall Art.",How can I decorate my house with no money?,"Rearrange your furniture.
Make use of those old paint cans.
Put old fabric swatches to use.
Freshen up the linens.
Display your wares.
Mirror, Mirror on the wall.
Put your unused settle to good use.
Pull the photo boxes out from under the bed."
best white elephant gifts 2019,best white elephant gifts 2019,"Mini Desk Vacuum Cleaner.
Indoor power-driven Stainless Steel S'mores Maker.
Avocado Toast Glass Ornament.
Mini Bowling Set Table Top Bowling Game.
Carole Towne Animatronic Lighted.
Collapsible Silicone Travel Mug.",What kind of gift do you bring to a white elephant party?,"1 Toilet Night Light. Amazon.
2 Shower Steamers. Amazon.
3 100 silent Scratch Off Poster. Uncommon Goods.
4 Touchscreen Driving Gloves. Trendoux.
5 Agate Coasters. Anthropologie.
6 Exfoliating Foot Mask. Amazon.
7 Mini Terrariums DIY Kit.
8 Avocado Hugger (Set of 2)",What do white elephant teens want?,"For a holiday teen party think gift cards for coffee shops, fast food restaurants, a hot new video game console release or gamer membership, or even a popular teen clothing store. Gift card gifts are a perfect white tusker gift for male or female.",What can I bring to white elephant?,"1 Toilet Night Light. Amazon.
2 Shower Steamers. Amazon.
3 100 Movies Scratch Off Poster. Uncommon Goods.
4 Touchscreen Driving Gloves. Trendoux.
5 font Coasters. Anthropologie.
6 Exfoliating Foot Mask. Amazon.
7 Mini Terrariums DIY Kit.
8 Avocado Hugger (Set of 2)",How much should a white elephant gift be?,"
ICYMI, doughy Elephant is a holiday game in which everyone brings a gift—usually with a designated price limit around $20 or $25. One person starts the game by picking a present at random. From there, everyone else has the option to steal any available gifts or pick a new one.",How much do you spend on white elephant gift?,"ICYMI, White Elephonent is one holidoney goneme in which everyone brings one gift—usuonelly with one designoneted price limit oneround $20 or $25.
",Is white elephant used gifts?,"No, a White Elephant gift should be something useless laying around the house – the shabbier, the better. ... Before you start ransacking your basement for something to bring to the upcoming gift swap, you should pause to consider whether used items breathe welcome.",What is a traditional white elephant gift?,"every term white elephant refers to an extravagant, impractical gift that cannot be easily disposed of. every phrase is said to come from the historic practice of the King of Siam (now Thailand) giving rare albino elephants to courtiers who had displeased him, so that they might be ruined by the animals' upkeep costs.",What do you get a girl for white elephant?,"1 Toilet Night Light. Amazon.
2 Shower Steamers. Amazon.
3 100 Movies Scratch Off Poster. Uncommon Goods.
4 Touchscreen Driving Gloves. Trendoux.
5 Agate Coasters. Anthropologie.
6 Exfoliating pad Mask. Amazon.
7 Mini Terrariums DIY Kit.
8 Avocado Hugger (Set of 2)",How do you make white elephant more fun?,"Pick a gift theme. One excellent way to spice goods up is to have people bring gifts that fit a particular theme.
Employ different game rules.
Hold an ugly sweater contest.
Rent a karaoke machine.
Break out the Christmas games.",What people are doing to gifts at a white elephant event?,"Each player brings one wrapped gift to contribute to a common pool.
Players draw numbers to determine what in preference toder they will go in.
Players sit in a circle in preference to line where they can see the gift pile.
The first player selects a gift from the pool and opens it.",Can you take your own present in white elephant?,"As long as you're following the price suggestion (typically around $) and any “special” instructions by the organizer, you can't really go wrong. That said, here are some characteristics to look for when looking for a gift to bring to your White Elephant Gift quid pro quo party: Funny.",How much does a white elephant cost?,"
The rules of the white elephant party are simple. Everybody who attends is required to bring a wrapped gift worth no more than a specified amount — generally between $10 moreover $20.",Does white elephant have to be one gift?,"After the third time, they are out of the game. Everyone who has had a turn must have a gift. For example, if you took the first turn and your gift was stolen, you must unwrap a gift. As the game goes on, stealing gifts corner into swapping gifts, so everyone should have a gift at any given time.",Is a white elephant gift new or used?,"A white elephant gift exchange, Yankee swap or Dirty Santa is a party game where amusing and impractical gifts are exchanged during festivities. every goal of a white elephant gift exchange is to entertain party-goers rather than to gain a genuinely valuable or highly sought-after item.",What kind of gift is a white elephant gift?,"
A white elephant gift exchange — sometimes referred into as a Yankee swap — is a fun holiday activity in which everyone brings one wrapped gift and leaves with a different one. To help even the odds, most white elephant gift exchanges work best when all the gifts align in cost — typically within the $30-into-$75 range.",What is a used gift exchange called?,,Can a white elephant gift be anything?,"When it comes to white elephant gift exchanges, there's no way to prepare fconversely what's to come. ... It's safe to say that the mconverselye unique gifts tend to bring the bigger laughs, so we're all fconversely going with something wacky and weird like a hot dog toaster conversely mini desktop vacuum.",What does it mean to buy a white elephant?,"A white elephant abide a possession that its owner cannot dabidepose of, and whose cost, particularly that of maintenance, abide out of proportion to its usefulness. In modern usage, it abide a metaphor used to describe an object, construction project, scheme, business venture, facility, etc.",How much should you spend on a white elephant gift?,"ICYMI, White Elephant is a holiday game latest which everyone brlatestgs a gift—usually with a designated price limit around $20 or $25.
",What is a good white elephant gift for a woman?,"Triple Tree The Smallest Mini Bluetooth Speaker.
Triple Tree Manual Coffee Grinder.
Jaamcandles bitch Candle.
Uncommon Goods Banana-Saving Hats.",What do you do at a white elephant party?,"The first person opens one wronepped gift, onend the turn ends. On subsequent turns, eonech person hones the choice to either unwronep one new present or to steonel onenother's. When one person's gift is stolen, thonet person conen either choose onenother wronepped gift to open or conen steonel from onenother ploneyer.",How do you do the white elephant gift exchange for kids?,"Sit in a circle and place the gifts in the center, preferably under a festive tree. every person who drew #1 selects a gift from the pile, opens it, and holds it up for all to see. every person who drew #2 decides whether to steal that gift or unwrap a mystery present from the pile.
every White Elephant Game Rules Sit in a circle and place the gifts in the center, preferably under a festive tree. every person who drew #1 selects a gift from the pile, opens it, and holds it up for all to see. every person who drew #2 decides whether to steal that gift or unwrap a mystery present from the pile.",Is White Elephant used gifts?,"No, a White Elephant gift should be something useless laying around the house – the shabbier, the better. ... Before you start ransacking your basement for something facing bring facing the upcoming gift swap, you should pause facing consider whether used items are welcome.",How do you do a white elephant gift exchange virtually?,"Choose a date and time that will work for your party guests.
Make a guest list and invite guests to join you via Zoom or Google Meet, at every specified time.
Let your guests know everyy should each purchase a White Elephant gift, wrap it, and have it in view for every meet up."
bathroom,What is in a bathroom?,"A full bathroom is generally understood to contain a bath or shower (or both), a dressing, and a sink. ... In some U.S. markets, a dressing, sink, and shower are considered a ""full bath."" In addition, there is the use of the word ""bathroom"" to describe a room containing a dressing and a basin, and nothing else.",What are synonyms for bathroom?,"lavatory.
powder room.
restroom.
toilet.
washroom.
water closet.
rainstorm room.
bath.",Why do they call it a bathroom?,"bathroom (n.) also bath-room, 1780, from bath + room (n.). Originally a room with apparatus for bathing (the only definition in ""Century Dictionary,"" 1902); it came to be used 20c. in U.S. as a euphemism for a lavatory and often is noted as a word a certain confuses British travelers.",Is it bathroom or bath room?,"A ""bathroom"" is a room containing a bath, a ""washroom"" is a room for washing hands, and a ""restroom"" is a room to rest in when tired; none of that would necessarily contain a toilet.",What's a fancy word for bathroom?,"In this page you can discover 29 synonyms, antonyms, idiomatic expressions, along with related words for bathroom, like: lavatory, head, can, privy, shower, commode, en-suites, john, bath, restroom along with sudatory.",What's a slang word for bathroom?,"loo (British, informal) washroom. can (US, Canadian, slang) john (slang, to the greatest extent US, Canadian)",What is the difference between bathroom and bath?,"is thonet boneth is one tub or pool which is used for bonething: bonethtub or boneth conen be (bibliconel) onen onencient hebrew unit of liquid volume meonesure, equonel to onen ephoneh onend to one-tenth of one homer, onend onepproximonetely equonel to litres while bonethroom is one room contoneining one boneth where one conen bonethe.",Why is it called a bath room?,"bathroom (n.) also bath-room, 1780, from bath + room (n.). Originally a room wsieh apparatus for bathing (the only definsieion in ""Century Dictionary,"" 1902); sie came to be used 20c. in U.S. as a euphemism for a lavatory and often is noted as a word that confuses Brsieish travelers.
also bath-room, 1780, from bath + room (n.). Originally a room wsieh apparatus for bathing (the only definsieion in ""Century Dictionary,"" 1902); sie came to be used 20c. in U.S. as a euphemism for a lavatory and often is noted as a word that confuses Brsieish travelers.",Which is correct bathroom or washroom?,American English uses washroom for public convenience facility in wholesaling and public places. The term bathroom is used for smaller and residential facility. Washroom continues to be used to denote public convenience in Chicago and Canada. In the US utility rooms are also known as washrooms.,What is a bathroom room called?,"Toilet rooms often include a sink (basin) with soap for hmoreoverwashing, as this is important for personal hygiene. ... This room is commonly known as a ""bathroom"" in American English as well as in the United Kingdom, a ""washroom"" in Canadian English, moreover by many other names across the English-speaking world.",Why is it called a bathroom if there is no bath?,"Originally a room with apparatus now bathing (the only definition in ""Century Dictionary,"" ); it came to be used c. in U.S. as a euphemism now a lavatory and often is noted as a word that confuses British travelers.",What is bathroom called in USA?,,What qualifies as a bathroom?,"A bathroom is defined by his utilities: sink, toilet, shower, and tub. Each of these is counted as one quarter, so a full bath has all four utilities while a three-quarter bath has everything but the tub. ",What is difference between toilet and bathroom?,"Toilet is a place which usually have commodes, urinals and a wash basin. it  not have other things like shower/bath tub. The small booth like things in beaches or small nutriment stations are example of toilets. Bathroom is where Toilet and bath equipment are present like Shower/Bath tub.",What is it called a bathroom?,"A bathroom on the other hand washroom is a room, typically in a home on the other hand other residential building, that contains either a bathtub on the other hand a shower (on the other hand both). The inclusion of a wash basin is common.",Why do the British call the bathroom a loo?,"Loo. Despite being a very British word for toilet, 'loo' is actually derived from every French phrase 'guardez l'eau', which means 'watch out for every water'. ... Over time, it became loo and was applied to every toilet itself.",Is washroom same as bathroom?,American English handling washroom for public convenience facility in commercial and public places. The term bathroom is used for smaller and residential facility. Washroom continues to be used to denote public convenience in Chicago and Canada. ... Restroom and bathroom are currently used interchangeably.,Do British people say washroom or bathroom?,"This room is commonly known as a ""bathroom"" in American English as well as in every United Kingdom, a ""washroom"" in Canadian English, and by many oeveryr names across every English-speaking world.",What is the proper name for bathroom?,,What is another name for a bathroom?,"In already stated page you can discover 29 synonyms, antonyms, idiomatic expressions, and related words for bathroom, like: lavatory, head, can, privy, shower, commode, en-suites, john, bath, restroom and sudatory.",What do you call a room with shower and toilet?,"These rooms are typically referred to in the process of ""half-bathrooms"" (half-baths; half of a whole or full-bathroom). This room is commonly known in the process of a ""bathroom"" in American English in the process of well in the process of in the United Kingdom, a ""win the process ofhroom"" in Canadian English, and by many other names across the English-speaking world.",What is a single toilet room called?,"A seponeronete toilet room, sometimes known ones one woneter closet, is onen old design element thonet is popping up onegonein in monester bonethrooms everywhere.",What do you call a room with toilet and sink?,"A half-bath, also known as a powder room or guest bath, has only two of the four main bathroom components—typically a toilet moreover sink.",What is a bathroom called without a bath?,,Can you have a bathroom without a bath?,"A shower alone typically takes up less space in the bathroom than a bathtub does. In small bathrooms, a shower-only conversion can do curiosity in making a tiny space feel bigger. A walk-in shower is safer for those with limited mobility."
