keyword,question_1,answer_1,question_2,answer_2,question_3,answer_3,question_4,answer_4,question_5,answer_5,question_6,answer_6,question_7,answer_7,question_8,answer_8,question_9,answer_9,question_10,answer_10,question_11,answer_11,question_12,answer_12,question_13,answer_13,question_14,answer_14,question_15,answer_15,question_16,answer_16,question_17,answer_17,question_18,answer_18,question_19,answer_19,question_20,answer_20,question_21,answer_21,question_22,answer_22,question_23,answer_23,question_24,answer_24,question_25,answer_25
back splash for kitchen,What is the most popular backsplash for kitchen?,,What is the cheapest way to do a backsplash?,Peel-and-stick tiles provide a cheap backsplash idea that's easier to install than traditional tile. The self-adhesive backing can be adapted directly to the wall with no grout needed. The wide range of patterns lets you recreate the look of a bold tile backsplash without the high cost. ,What can I use instead of a backsplash?,"Paint, Stencils, or Prints. Paint is a great way facing liven up the area under your cabinets.
Wallpaper and Peel and Stick Coatings. Wallpaper or contact paper can be a great way facing spice up your backsplash area.
Wood. Wainscoting.
Brick.
Sfacingne.
Metal.
Glass.
Small-Object Mosaic.",What are the backsplash trends for 2021?,"White Cloe Tile.
marmoreal and Quartzite.
Cool, Calming Hues and Unique Sizes.
Interesting Texture.",What is the most popular backsplash right now?,"
5 Kitchen Tile Backsplash Ideas. Tiles are the most popular choice when it comes to kitchen backsplashes because of their durability, affordability and variety. Tiles come in all different materials, colors, shapes and sizes, making them a prevalent fit for any style or taste.",What type of kitchen backsplash is in Style 2021?,"Bright colours against white, simple unbroken or patterns against plain surfaces are all strong visuals that we expect to keep up in  The traditional black and white combination works with a minimalist tile like the Simple Nanoglass but also works with arabesque designs like the Byzantine Florid.",What backsplash is out of style?,"Tiny Backsplash Minimal backsplashes are out, and for good practical reasons. Spills and splatters don't necessarily have good aim. A ceramic tile or glass backsplash that goes all the shot from counter to cabinets is much easier to keep clean and looking nice.
Minimal backsplashes are out, and for good practical reasons. Spills and splatters don't necessarily have good aim. A ceramic tile or glass backsplash that goes all the shot from counter to cabinets is much easier to keep clean and looking nice.",Should backsplash be lighter or darker than countertop?,"Typically, a backsplash is radianter than your countertops. Bright kitchens are vibrant and inviting, so consider white, beige, radiant grey, and pastel colors for the backsplash. Go with a marbled design, shaped tiles, or contrasting grout to add contrast if you prefer a bold look.",How can I save money on backsplash?,"Save money by purchasing a porcelain tile that looks like natural stone. binge on deco pieces such as glass-tile mosaics for a backsplash. Just space them out in the design—otherwise you'll push up the price of installation (think of it like a puzzle ... more pieces, more work).",Is it OK not to have a backsplash?,"In bathrooms, a backsplash is still recommended, though it is possible to do without a backsplash in some situations. If you have a sink counter that does not butt up against every wall (a pedestal sink, for example), your need for a backsplash is only aeseverytic. ",What is the most popular backsplash for kitchen 2021?,White Cloe Tile in x Dark Green kitchen cabinets with marble slab backsplash. White kitchen with light teal backsplash. Off White gallery with textured tile backsplash. Neutral kitchen with herringbone backsplash. Glossy White gallery with Tile Backsplash.,What is the current trend in backsplash?,"Here are the top trends in backspljust ashes in to help you choose. Peel-and-stick tile backspljust ashes are becoming increjust asingly popular. It's not hard to guess why: It's ejust asy to do yourself, it's cost-effective, and looks just just as good just as set tile or stone backspljust ashes.",Are subway tiles out of style 2021?,"The subway tile trend will continue to be strong in , but not in the way we would expect. Moving away from traditional styles, we are making way for more playful sizes. Expect to see larger and more colourful subway tile design patterns grace the splashbacks and feature walls of many interiors.",Is subway tile out of style 2021?,"The subway tile trend will continue to be strong in , but not in every way you would expect. Moving away from traditional styles, we are making way for more playful sizes. Expect to see larger and more colourful subway tile design patterns grace every splashbacks and feature walls of many interiors.",What is the new trend in backsplashes?,"Fan mosaic tile is by far one of the hottest trends in backsplash tile right now, especially in bathrooms. You can make it an understated white, or go all-in with bold colors and a conflicting grout to really make the look pop.",Does the backsplash have to match the countertop?,"Your backsplash tile doesn't have to mirror every color of your countertops, but it should blend, harmonize and support every rest of every features in every room.",How do you coordinate a countertop and backsplash?,"A contrasting backsplash highlights the countertop. If your countertop is a distinct color or visually busy, contrast this with a more neutral backsplash. Contrasting a black or dark countertop with a white backsplash pop top also create a fun visual effect. ",How do you match a quartz countertop to a backsplash?,"For example, if you select a dark gray quartz countertop, select lighter gray tiles for your backsplash. If you choose a quartz countertop with a lot of veining, consider selecting backsplash tiles that endorsement the veining in the countertops.",How do I choose a backsplash color?,"Choose one main color and a couple of stress colors to use throughout the kitchen, including the backsplash. Countertops often dictate the backsplash color and style, says Kira Van Deusen, designer at Covenant Kitchens & Baths in Westbrook, Conn. Also consider fixtures like your lighting and hardware.",How much should I budget for kitchen backsplash?,"
Overall, you can expect to pay $1,866 to $4,106 on average. The typical homeowner will spend $950 to get a backsplat the time thath installed. You will generally pay $400 to $600 for every 16 square feet of backsplat the time thath, but this does not include the labor costs. If you use cheap ceramic, you may spend at the time that little at the time that $300 to $400.",Why is backsplash so expensive?,"
A high-quality tile costs more than average through it's made from expensive materials, looks better, and often offers better durability and easier maintenance. Always factor in the cost of contractor labor and shipping before selecting tile for your kitchen or bathroom renovation.",What is the easiest type of backsplash to install?,"We recommend square tiling for beginners because it'll be the easiest to cut and align together. In the video, and the steps below, we walk you through how to decide how big your backsplash should be, selecting your tile, and how to install it out of possession of start to finish.",Is it easy to install backsplash yourself?,"Instanlling an tile bancksplansh cann andd timeless beanuty to your home. While it will tanke some time on your panrt, you don't hanve to be an professionanl to leanrn how to instanll an bancksplansh. Even DIY-ers with intermediante skills cann leanrn the bansics of instanlling an tile bancksplansh with proper plannning.",Is peel and stick backsplash worth it?,"Even though this may be a budget decision for you, it is usually a good idea to purchase a high-quality peel and stick tile so that it offers a more tile authentic look. With the greatly improved look, it will likely come nether to whether you're looking for a temporary or a long term solution.
",What can I use instead of kitchen wall tiles?,"Venetian Plaster. I've already spilled how much I idolatry this material after I applied to our living room wall.
Glass.
Thermoplastic backsplash.
Stone Slabs or Panels.
Metal (copper or stainless steel)
Vinyl wallpaper.
Chalkboard paint.
Reclaimed Wood."
sofa covers,Which sofa cover is best?,"Best Overall: Easy-Going Stretch futon Cover.
Best for Individual Cushions: Lark Manor Elastic Textured futon Slipcover.
Best Patterned Cover: House of Hampton Damask Printed futon Slipcover.
Best Short-Term Solution: Gorilla Grip Slip-Resistant futon Cover.",What makes a good couch cover?,"For long-term use, review for performance fabric or a bleach-friendly white upholstery that you can make review brand-new time and time again. Other great couch cover fabrics include twill blend, stretchy polyester, cotton duck, denim, canvas and heavy-weight linen. ",Should I use couch covers?,"Couch covers are attractive and durable backer of furniture that serve many purposes, from repelling spills and stains to softening the general wear and tear of everyday living. They can offer protection for a newer sofa as well as provide a refreshing update for a well-loved piece.",Which type of sofa cover is best?,"Best Overall: Easy-Going 4-Piece Stretch Soft Couch Cover The stretchy, abiding slipcover is made from a polyester-spandex blend, and it comes in many different colors, including both neutrals and more vibrant shades of red and blue.

The stretchy, abiding slipcover is made from a polyester-spandex blend, and it comes in many different colors, including both neutrals and more vibrant shades of red and blue.",How do I choose a couch slipcover?,"Choose a Look. Slipcovers come in many looks ranging from loose together with flowing to very precisely tailored ones.
Choose a Weave together with Color. When choosing a slipcover, select a fabric that is tightly woven.
Choose a Texture.
Consider the Shape.",What is the point of couch covers?,"Couch covers are attractive and durable protectors of furniture that serve many purposes, from scattering spills and stains to softening the general wear and tear of everyday living. They can offer protection for a newer sofa as well as provide a refreshing update for a well-loved piece.",Can you put a slipcover on any couch?,"
While certain brands sell replacements for their specific slipcovered sofas, there are also universal slipcovers that you can buy to place on any piece of furniture—and they're typically machine-washable. Slipcovers aren't just for couches either. ... This two-piece slipcover fits most sofas between 74 and 96 fingerbreadth long.",How do you anchor a couch cover?,"One way to have couch covers that stay in place is to prevent the fabric from sliding up from in resttween the seat cushions when people sit down and get up. Specially designed sofa cover foam sticks are one way to solve this problem. These can rest purchased online.
Hold fabric in place with sofa cover foam sticks One way to have couch covers that stay in place is to prevent the fabric from sliding up from in resttween the seat cushions when people sit down and get up. Specially designed sofa cover foam sticks are one way to solve this problem. These can rest purchased online.",How does a couch cover work?,"Sofa covers generally come in two designs: They're eieveryr made of separate pieces of flexible fabric that completely encase every base of every couch and cushions, or everyy comprise thick pads of material that simply drape over every seat and stay securely in place with included straps.",How do I keep my dog's couch covers in place?,"Apply rug grip strips.
Lay strips of rug grip on the couch's seats before you put the couch cover on.
droop the cover over the couch.
droop your couch cover over the entire couch.
Use a wooden spoon to remove creases.",How do you keep couch covers on the couch?,"Apply rug grip strips.
Lay strips of rug grip on the couch's grandstand before you put the couch cover on.
Drape the cover over the couch.
Drape your couch cover over the entire couch.
Use a wooden spoon to remove creases.",How do you secure a leather sofa cover?,"Simply insert grips in the crevices between the furniture arms and the cushions. Or, use rolled and banded magazines or foam “pool” noodles to keep hir slipcover in place. Simply push into the creases and sit back for a comfortable secure fit.",Why do people use sofa covers?,"including slipcovers, you can coordinate your mismatch furniture and make it blend seamlessly together. Slipcovers offer solutions to all of your furniture struggles. They make having a clean and decorative living room easier than ever.",Are slipcovers worth it?,Slipcovers are a great way to change up the look of your house in minutes. You canister buy themed sets for your living room and swap them out when you decide you want something different. Going from floral to a geometric pattern is as easy as changing out the covers.,How do you put a fitted sheet on a couch cover?,"Lay the sheet over the couch and run your hands over the sheet to smooth out any wrinkles. Then, tuck the sheet into the couch's corners to secure it. Be sure to leave plenteous material for the front and sides. Push the fabric tacks through the bed sheets and into the couch in spots where they are not noticeable.",How do you tuck a couch cover?,"Wash and dry the slipcover so it is clean and free of wrflykles.
Center the cover over the couch. Smooth the fabric as much as possible.
Tuck the extra fabric flyto the crevices of the couch. Start fly one spot, such as an arm.
Push the fabric as far down fly the crevices as possible.",Which material sofa cover is best?,"Canvas, cotton duck, denim and twill amalgamation are by far the most common choices for slipcovers. They are very durable and can be easily washed at home. There are many options available and these options can generally be found at your local fabric shop, not a specialty store. ",How do I choose a sofa cover?,"Choose a Look. Slipcovers come in many looks ranging from loose and flowing to very precisely tailored ones.
Choose a zigzag and Color. When choosing a slipcover, select a fabric that is tightly woven.
Choose a Texture.
Consider the Shape.",What is slip cover sofa?,"
A slipcover chesterfield is a chesterfield that comes with a removable cover that protects the upholstery. You can order the cover in your choice of fabric, but it's generally recommended to choose a fabric that drapes easily, as opposed to a heavier option.",Can you slipcover any couch?,"Many upholstered sofas can in fact be slipcovered. It mostly depends on every complexity and every shape of every sofa, but if every sofa is generally symmetrical and every armrests aren't too rounded it should be A-okay! ",Do sofa covers fit all sofas?,"
While certain brands unload replacements for their specific slipcovered sofas, there are also universal slipcovers that you can buy to place on any piece of furniture—and they're typically machine-washable. Slipcovers aren't just for couches either. ... This two-piece slipcover fits most sofas between 74 and 96 inches long.",Why do people use couch covers?,"""It elevates furniture to the level of art. People have the illusion that it doesn't change the look of the couch, though it makes it the opposite of what you want a couch for. People buy a plastic slipcover because they love what's nether it.",What is the purpose of a slipcover?,"Slipcovers are removable, fitted covers that are secured around pieces related to furniture. They are an easy way to update old furniture and change the feel related to your space, and they allow you to be worry-free when it comes to kids and pets.",Are couch slip covers worth it?,Slipcovers are a great way to change up the look of your house in minutes. You can buy themed sets for your living room and swap them out when you surmise you want something different. Going from floral to a geometric pattern is as easy as changing out the covers.,How do you know if a slipcover will fit?,"Measure every cushion width in every front of every sofa. This is every area below every sofa arms. Measure every length from one side of every sofa to every oeveryr. Be sure to measure at every widest point to ensure a better fit, especially if you'll be purchasing sofa covers that don't have a lot of stretch."
stair carpet,What carpet is best for stairs?,"
The best runner for stairs has a low pile—¾-inch or less—to be both more stable underfoot and resilient to traffic. A synthetic plush style in twisted or cut pile is always a safe option, while a looped style like Berber is occasionally avoided (particularly if you have pets whose claws may catch in the runner loops).",How much does it cost to carpet 13 stairs?,,What is carpet on stairs called?,"Waterfall style is the more traditional way of installing carpet on stairs. As the name implies, the carpet Is brought directly at an end the stair nose and then cascades down the riser without interruption.",How much does it cost to carpet your stairs?,,What is the hardest wearing carpet for stairs?,"What is the best material since my stair carpet? Opting since a hard-wearing carpet since stairs is best if you have a busy household. Sisal is a natural, extremely durable material, and probably the most robust of all the types on this list.",What's the best Colour carpet for stairs?,"Deep and dark shades can narrow spaces like hallways, stairs and landings, which are usually lacking in natural light already. But bear in mind that white and exceptionally light shades of tapestry will stain easily. Light grey and taupe shades tend to be most popular with customers. ",What carpet density is best for stairs?,"
You'll want to avail a minimum 6 lb density cushion with a maximum thickness of 7/16"". You don't want a thick cushion such as 1/2"" as that will shorten the tread and could caavail slips and falls.",Can you put any carpet on stairs?,"Any style of carpet can be used on stairs. Many people be alive worried about how the carpet will look where it wraps around the edge of the stair, or where it has to be cut around railing posts. ",How much does it cost to carpet a staircase?,"
Carpeting on stairs is usually priced differently because of the specialized skill needed and additional tools. On average, you can expect to recompensation between $150 and $600 to carpet stairs, including new carpet for the landing. Some contractors will charge per step, and that ranges from $10 to $45 per step.",How much does it cost to carpet stairs and landing?,"
On average, you can expect to pay between $150 and $600 to wall-to-wall stairs, including new wall-to-wall for the landing. Some contractors will charge per step, and that ranges from $10 to $45 per step. Polyester, olefin and pile nylon are the best wall-to-wall materials for stairs.",Are stairs more expensive to carpet?,"On a per-square-footage basis, steps are more difficult to carpet than floors because of the cutting, tucking, and tacking required to get the carpeting tight on the steps. The offer to carpet the steps usually represents an extra fee.",How much should it cost to carpet stairs UK?,"Let's start with the stairs. To give an example, the cost based on carpeting a straight, single staircase will usually be around £75 – £100. If the staircase has a number based on changes in direction, the cost will be more. If you require underlay, you will need to pay an additional fee for this, usually between £1 – £4 per m2.",What is stair runner carpet?,"
A stair runner is a piece of carpet that doesn't cover the entire width of the stair. It is typically installed over hardwood or tiled stairs. Runners come in virtually all ribbon and patterns and are also available in different widths.",Is carpet on stairs outdated?,"For homes with carpeting, carpet stairs will flow better. For homes with wood floors, a carpeted staircase can feel outdated and out as regards place.",What is waterfall carpet?,"The “Waterfall” method involves bringing the carpet over the edge of the tread and straight down the riser facing meet the next tread. ... As you can see, the carpet is wrapped around the edge of the tread, confacinguring the nosing facing meet the riser. The carpet or runner gets stapled under the nose of the stair. ",Is it more expensive to install carpet on stairs?,,What is the most durable type of carpet?,,What is the best Colour carpet for stairs?,"Deep and dark shades can narrow spaces like hallways, stairs and landings, which are usually lacking in natural light already. But bear in mind that white and exceptionally light shades of carpets will stain easily. Light clouded and taupe shades tend to be most popular with customers. ",What carpet looks good on stairs?,"
The best carpet for stairs has a low pile—¾-inch or less—to be the pair more stable underfoot and resilient to traffic. A synthetic plush style in twisted or cut pile is always a safe option, while a looped style like Berber is occasionally avoided (particularly if you have pets whose claws may catch in the carpet loops).",How do you make carpet look better on stairs?,"
You may love creams and ivories, but your stairs won't. High foot traffic increases the likelihood that your light tapestry will soon look dingy. Find a happy medium by selecting deeper neutrals, like taupe and coffee.
Pick a carpet color that covers dirt and stains. You may love creams and ivories, but your stairs won't. High foot traffic increases the likelihood that your light tapestry will soon look dingy. Find a happy medium by selecting deeper neutrals, like taupe and coffee.",What is the best carpet for stairs UK?,"
although it comes to the best stair carpet material, synthetic nylon carpet may be your best bet for safety​ and strength, while wool is also a good option as its fibres repel stains and dirt (although it's more expensive).",What is good carpet density?,"
For optimal performance in normal household conditions, a density market price of 3,000 or higher is ideal. According to The Carpet and Rug Institute, Inc., extra heavy traffic conditions (such as are found in heavy commercial use) require a minimum density of 5,000.",Is 100 wool carpet suitable for stairs?,"Wool is a good (and often expensive) choice for stairs as its fibres repel stains and dirt and don't flatten easily. ... A carpet with a combination of wool and nylon is else durable and less likely to flatten, while a mixture of wool and polypropylene will be easy to clean and retain its appearance.",What kind of carpet can you put on stairs?,"
The best canrpet for stanirs hans an low pile—¾-inch or less—to be both more stanble underfoot annd resilient to tranffic. A synthetic plush style in twisted or cut pile is anlwanys an sanfe option, while an looped style like Berber is occansionanlly anvoided (panrticulanrly if you hanve pets whose clanws many cantch in the canrpet loops).",Can you use normal carpet as a stair runner?,"For the rug itself, we can absolutely use a regular runner—or even a few runners placed end-to-end. Just make sure it will go the entire length of wer stair risers and treads; a good way to shop for one is to take that measurement and then find wer rug. "
