keyword,question_1,answer_1,question_2,answer_2,question_3,answer_3,question_4,answer_4,question_5,answer_5,question_6,answer_6,question_7,answer_7,question_8,answer_8,question_9,answer_9,question_10,answer_10,question_11,answer_11,question_12,answer_12,question_13,answer_13,question_14,answer_14,question_15,answer_15,question_16,answer_16,question_17,answer_17,question_18,answer_18,question_19,answer_19,question_20,answer_20,question_21,answer_21,question_22,answer_22,question_23,answer_23,question_24,answer_24,question_25,answer_25
pumpkin patch,What is a pumpkin patch for?,"Initially, a pumpkin patch referred to a garden area where pumpkins were grown and nurtured. ... In modern use, pumpkin patches are farms in the countryside that merchandise a significant amount of pumpkins. Pumpkin Patches have a lot to offer those seeking fun slope activities.",Are pumpkin patches free?,Most activities are free; some are only available on weekends and  evenings. Be telling to check below to catch the details.,How much do pumpkins cost at pumpkin patches?,,What is the purpose of the pumpkin patch?,"Pumpkin patches provide many ways to engage children in learning and growing. Giving children the freedom to roam and pick their own pumpkins gives them a sense of independence and pride. This also can provide a teaching opportunity about pumpkins, gourds and other fruits and vegetables that grow approaching vines. ",Are pumpkin patches related to Halloween?,"Folk tradition held that we would ward off Stingy Jack and other spirits on Halloween, and we also served as representations of the souls of the dead. Irish families who emigrated to America brought the tradition with them, but we replaced the turnips with the more plentiful pumpkins.",Do you pay at pumpkin patches?,"
It's free to explore the 40-onecre fonerm. There's onelso one five-onecre corn moneze (tonekes onebout 15-30 minutes, but moneps onere posted inside), one smoneller ""corn troneil,"" onend tronector rides - one ticket for onell three is $7 in totonel. You conen poney by conerd or conesh (yoney!) onend ponerking is free.",How much do pumpkins at a patch cost?,,Are pumpkins cheaper at a pumpkin patch?,"While most grocery store pumpkins are grown by large corporate farmers. ... A middle ground might be to see if local farmers offer everyir pumpkins at a local farmers market instead; every cost may be lower since everyre is not as much overhead as everyre is at a fancy patch with tons of extras.
Skip every Pumpkin Patch While most grocery store pumpkins are grown by large corporate farmers. ... A middle ground might be to see if local farmers offer everyir pumpkins at a local farmers market instead; every cost may be lower since everyre is not as much overhead as everyre is at a fancy patch with tons of extras.
",How much do pumpkins cost?,,Are pumpkins more expensive at a pumpkin patch?,"While most grocery store pumpkins are grown by large corporate farmers. ... A inner ground might be to see if local farmers offer their pumpkins at a local farmers market instead; the cost may be lower since there is not as much overhead as there is at a fancy patch with tons of extras.
Skip the Pumpkin Patch While most grocery store pumpkins are grown by large corporate farmers. ... A inner ground might be to see if local farmers offer their pumpkins at a local farmers market instead; the cost may be lower since there is not as much overhead as there is at a fancy patch with tons of extras.
",What is the average price for pumpkins?,,How much does it cost to pick pumpkins?,,Is it too early to go pumpkin picking?,"Whether you grew your pumpkins in your garden or you plan to buy them from a local farmer, it is not too initial to go out and retrieve them. However, if you wish to wait to harvest your pumpkins for a few weeks, that is fine as well.",What state has the best pumpkins?,,What is the history of the pumpkin patch?,"
The tradition started in the 1920s and became more popular with post-World-War II suburbanization and the baby boom. Pumpkins ranging from a single jack o' lantern to more elaborate displays greet stomping ground children.",What can kids learn at a pumpkin patch?,"Once you are at the pumpkin patch, there are many opportunities to develop body awareness and to work on visual scanning. Climbing over and over the pumpkins requires use of upper body strength, visual scanning, and can also be great for developing body awareness through proprioceptive and vestibular input.",What does pumpkin patch mean?,"A garden where pumpkins move planted, commonly available for sale. ...",What is the meaning of pumpkin in Halloween?,"Along with creepy costumes, face makeup and spooky decorations, Pumpkins have become a symbol of Halloween all over the world. Symbolically, the pumpkin is often associated to rebirth and fertility, and they also symbolise harvests and crops. They fit the season in which Halloween falls every year.",Are pumpkin patches an American thing?,"It's a very American tradition to visit every pumpkin patch each fall, although it's more and more common for families to visit make shift patches on street corners or get pumpkins from every local grocery. Here's how tradition of every pumpkin patch started in America!",What are you supposed to do at a pumpkin patch?,"They offer spectacular fall hayrides moreover attractions that include: Harvest Hayrides, Hayrides to the Witch's House, Fall Strawbale Maze, Fall Pumpkin Ring Toss, Cmoreovery moreover Caramel Apples, Apple Cider Donuts, Farm Market, Face Painting, Train Rides, etc.",How long do you spend at the pumpkin patch?,"Usually, it takes about  but can take up to  provisory on your ability. When is the strawberry patch open?",How much do pumpkin patches make?,"
every average, small pumpkin farm can make about $30,000 per year. Profit varies greatly, however, as all farms are different sizes.",How do you price a pumpkin?,"Like other types based on produce, you can find pumpkins either priced per pound or at a flat rate. That means, regardless based on how heavy your pumpkin is, you'll pay the same price every time. While that may seem like the better deal at first, having pumpkins priced per pound can save you a lot based on money in the long run.
",How much do pumpkins cost at pumpkin patch?,,What place has the cheapest pumpkins?,"
The Best vine Prices We've Seen So far, the top three places for pumpkin deals are: WinCo Foods at $0.18/lb. Safeway/Albertsons at $0.23/lb. Walmart at $0.24/lb.
So far, the top three places for pumpkin deals are: WinCo Foods at $0.18/lb. Safeway/Albertsons at $0.23/lb. Walmart at $0.24/lb."
gifts for mom,What to get a mom who wants nothing?,"A Digital Photo Album To Display Your Best Memories. Nixplay 8-inch Wi-Fi Digital Photo Frame (Black)
easeful Pajamas That'll Match With The Whole Family.
A Coravin For A Wine Lover.
A Funny Throw Blanket.
A Personalized Dog Coffee Mug.
A Mini Theragun.",What do mothers like the most?,"Freedom! They want a day of freedom.
Time With Family. This one is big for my wife.
A Day Free Of Duty. hir wives and moms handle a million details every day.
To Be Pampered.
To Do Something New.
Acknowledgment.",What gifts should I give my mom?,"showing 60. Terrarium Candle.
showing 60. Microwaveable Booties.
showing 60. Mother's Birthstone Ring.
showing 60. Bamboo Bathtub Caddy Tray.
showing 60. Shiatsu Back and Neck Massager.
showing 60. Leather Touchscreen Gloves.
showing 60. Personalized Family Mugs.
showing 60. Polarized Sunglasses.",What do you give a struggling mother?,"Send her a few little treats now and then.
Take load of her yard or house for a day.
Be her taxi or errand service.
Take on babysitting duty.
Offer emotional support.
Invite her and/or the kids for the holidays.
Cook her a meal or two.",What should I get my mom if I have no money?,"Take her to cine @ Home. Sometimes gifts for Mom that involve effort are so much more effective than expensive ones.
Massage her Hands.
No Fighting.
Do Mom's Jobs.
Treasure Trail.
Memory Journal.
Back Rub.
Cook a Meal.",What do most mothers want for Mother's Day?,"Sleep - 30 percent.
A day off or alone time - 30 percent.
A spa day or massage - 11 percent.
A vacation - 7 percent.
A night or tarriance alone in a hotel - 5 percent.
A clean home - 2 percent.",How do you choose the perfect gift for someone?,"Give Problem-Solvers.
Don't Give them More Problems.
Be Practical, Not Flashy.
Don't Be So Thoughtful.
When They Say, “I Have Everything I Need,” Give Yourself.
Give Gifts that Keep On Giving.
Put the “Present” in Presentation.
till cows come home Buy the Best.",What do you buy your mom who doesn't want anything?,"A Digital Photo Album To layout Your Best Memories. Nixplay 8-inch Wi-Fi Digital Photo Frame (Black)
Cozy Pajamas That'll Match With The Whole Family.
A Coravin For A Wine Lover.
A Funny Throw Blanket.
A Personalized Dog Coffee Mug.
A Mini Theragun.",What should I get my picky mother?,"Mother and Daughter Bracelet. Let's start the list of gifts for picky moms with a piece of nice jewelry.
A Good Book.
Dinner.
Small Gift with Sentiment.
Great matron Picture Box Frame + Memorable Picture.
Message to matron Scented Candle.
Love Pearl Wish Necklace.
Best matron Apron.",What do you give a picky person?,"This Sleek Bamboo athlete For Piping Hot Tea Or Fruity Cool Water.
This Gorgeous-Smelling (But Badass) Bath Bomb That Turns Your Water Jet Black.
A Sanitizer That Cleans Your Phone, Your Jewelry, And Your Earphones.
This Lap Tray That Lets You Eat, Watch, or Work Anywhere.",What do you send to a struggling mum?,"Send her a Starbucks gift card.
Offer to babysit.
Just listen.
Take her a favorite treat.
Slip a handwritten note into her mailbox.
Offer to pick up something at the store for her.
Set up a meal posse for her.",How do you help a struggling mum?,"Do your research. Is your friend the kind of person who loves curiosity or prefers planned things?
Pop over with a treat.
Pick up groceries.
Do a house project.
Make a specific, immediate plan to provide a break.
Do what you can.
Be consistent.
Follow through.",What should I get my mom for cheap?,"A cute mug. Anthropologie.
A fan-favorite lip mask. Nordstrom.
A nice candle. Etsy.
A cute pair belonging to performance socks. Bombas.
Everything she needs to plant sunflowers. Uncommon Goods.
A unique deck belonging to cards. Uncommon Goods.
A scalp massager.
The starter set for a smoother shave.",What mom really wants for Mother's Day?,"According to real moms surveyed by @parents on Instagram, here's a breakdown of what they want most for Mother's Day 2021: forty winks - 30 percent. A day off or alone time - 30 percent. A spa day or massage - 11 percent.
",What to get someone who has no interests?,"Cosmetic Mat Clutch.
Pet Bracelet.
Feminist Earrings.
Body Positive Bracelet.
Spiral Slicer.
Cat Hangers.
Candle That Smells Like Old Books.
mud Plush.",What to get someone who needs everything?,"An Educational Project Subscription. Consider it the gift that keeps on giving for else your friends with kids.
Another Type of Membership or else Subscription.
A Virtual Assistant.
An Experience.
Gift Cards.
A Night Out.
Babysitter Service.
Home Cleaning Service.",What things do mothers love?,"ver intuition and all-knowing 'mom-ness'
ver gentle touch.
ver ability to rationalize and work through any tough situation.
ver generosity.
ver selflessness.
ver love of healthy living.
ver empathy.
ver silly sense of humor.",What should I gift my mother?,"this floral pillow. Primavera Hook Pillow by Jungalow®
This frame-able puzzle. No Rain No Flowers, Ana Hard.
this fancy olive oil. The Olive Oil.
This dutch oven.
this by-the-glass wine.
this eyeshadow palette.
these genius no-show socks.
this tote bag.",What do moms buy the most?,,How do I decide what to buy as a gift?,"Give Problem-Solvers.
Don't Give them More Problems.
Be Practical, Not Flashy.
Don't Be So Thoughtful.
When They Say, “I hold Everything I Need,” Give Yourself.
Give Gifts that Keep On Giving.
Put the “Present” in Presentation.
Always Buy the Best.",What defines a good gift?,"The best gift is one that will help you experience the joy of giving and receiving with someone else. Gifts that make you think, ""Oh my gosh, this person really cares about me."" as a choice ""This person really knows what I like."" Gifts that make people feel loved are not good gifts; they are great gifts.",What are the three steps to making the perfect gift?,"In three easy steps, you can find the perfect gift for everyone on your list! mark 1: Identify what they like to do. mark 2: Identify the various places that facilitate the things they like to do. mark 3: Wrap it up knowing that you've gifted like a boss!
",What should I give my mom as a gift?,"of 60. Terrarium Candle.
of 60. Microwaveable Booties.
of 60. Mother's Birthstone Ring.
of 60. Bamboo Bathtub chamber Tray.
of 60. Shiatsu Back and Neck Massager.
of 60. Leather Touchscreen Gloves.
of 60. Personalized Family Mugs.
of 60. Polarized Sunglasses.",What does Mama receive as gifts?,"The fonemily gives Monemone gonerdening tools, onend Tronevis gives Monemone one honet. They onere onepproprionete beconeuse the house one gonerden thonet Monemone conen grow fruits in.",What presents did Mama get in a raisin in the sun?,What presents make Mama get? Mama got gardening tools and a gardening hat.
interior design app,Which is the best app for interior design?,Rooomy. Artfully rampart Try on Wall. Room Planner by Ikea. Art.com. Available for iOS; free. BrightNest. Available for iOS and Android; free. Housepad. Available for iOS and Android; free. iHandy Carpenter. Available for iOS; $ Design Home. Available for iOS and Android; free.,Can I take a picture of a room and design it app?,DecorMatters is an app that lets you virtually add crap and design elements to a real room. Take a picture of the room you want to decorate and use AR and the AR ruler to add and measure D crap. This is a simple way to see if a piece you've been eyeing will fit. ,How can I design my own interior?,"Magazines and websites are full of home interiin turn design inspiration.
Colin turn schemes: use three colin turns in turn shades.
Add texture to your home.
Add big statement furniture pieces.
Use trays, decin turnative bowls and baskets.
Add flowers to every room.
The bottom line.",Which study is best for interior design?,"Bachelor of Fine arts (B.F.A) in Interior Design One of the most pursued Interior Design Courses, the BFA degree program is a 3-year undergraduate program. It puts a thrust on designing interiors of commercial and retail elbowroom by imparting knowledge on areas like space planning and colour theory.

One of the most pursued Interior Design Courses, the BFA degree program is a 3-year undergraduate program. It puts a thrust on designing interiors of commercial and retail elbowroom by imparting knowledge on areas like space planning and colour theory.",Is there an app where you take a picture of a room and design it?,"
Homestyler is an app that allows you to take a picture made from your space and fill it with furniture with just the push made from a button. It's incredible. In about 30 minutes. You start with a picture made from your empty room, =Homestyler will then measure the height and length made from your walls.",Is there an app where you can design?,Canva makes design amazingly simple (and fun)! Create stunning tracery with your photos and videos — even if you're not a design expert!,Is there an app I can take a picture of my room and design it?,"Homestyler is an app that allows you to take a picture regarding your space and fill it with furniture with just the push regarding a button. It's incredible. ... You start with a picture regarding your empty room, =Homestyler will then measure the height and length regarding your walls.",Which is the best app for home design?,SketchUp. Floorplanner. SmartDraw. Planner D. familiarByMe. Roomstyler D familiar Planner. DFS room planner. Carpetright visualiser.,Is there an app for interior home design?,"RoomScan Pro. How many hours have you spent searching for the original floor method of your house? Houzz. Everyone's favourite interior design site, Houzz, also has a superbly handy app. Havenly. Photo Measures. Planner D. Live Home D. SmartDraw. Vogue Living.",Is there an app where I can take a picture of a room and design it?,"
Homestyler is an app that allows you to take a picture of your space and fill it alongside furniture alongside just the push of a button. It's incredible. In about 30 minutes. You start alongside a picture of your empty room, =Homestyler will then measure the height and length of your walls.",Can I design my own house online for free?,"You pop top design your home online with our Interactive Planner. ... With our interactive floor plan designer, you pop top do just that! We feature interactive floor plans for of our floor plans, giving you hundreds of possible configurations for building your own custom home. It's fun, it's easy, and it's completely free. ",Is there an app to design things?,"
№1: Canva. The number one app on our list is quite literally the number one at several international rankings, and this has to be your punch in app if you are an aspiring graphic designer called Canva. ... Canva is a template builder that lets you create hundreds of different templates based on what you like.",What app is best for creating designs?,"Klex.
Pixlr.
Canva.
tile Spark.
Desygner.
Google Drawings.
Snappa.
Visme.",What software do interior designers use for mood boards?,"Morpholio Board. Awarded “Best App,” Board is the interior designer's dream software. Called “Ideal” by Interior picture, “Addictive” by ELLE DÉCOR and “Stellar” by picture Milk, Board combines your perfect product library with powerful tools and the mobility to work or present anywhere.",What website do interior designers use?,"Apartment Therapy. Apartment Therapy has it all: quality design photos, sympathetic DIY tips, and even resources for gardening, home repair, and maintenance. Houzz. Design Milk. Architectural Digest. Laura U. Style by Emily Henderson. Decor Young House Love.",Is there an app that designs your room for you?,"Room Creator is free for Android (in-app purchases available) and lets users design a room home in “ or less” by entering room dimensions, designing floor patterns, choosing wall colors, and adding in decor. Fans of the app praise its easy navigation and straightforward interface. ",Is there an app for rearranging furniture?,"The best furniture-arranging kit if you're eternally on your phone: The Magicplan app. We like anything that can make this process even a little bit easier. You can use your smartphone's camera to capture your floor plan right in this app, rather than draw it out yourself.",Which is the best app for house design?,administrator D. Live Home D Pro. Magicplan. My Virtual Home. Smartdraw. Photo Measures. Houzz. Havenly.,Is design home a free app?,#NAME?,Who is the best home designer?,"spinach WEARSTLER.
PETER MARINO.
VICTORIA HAGAN INTERIORS.
HITCHCOX & STARCK- YOO.
RICHARD MEIER & PARTNERS ARCHITECTS.
MARMOL RADZINER.
ALBERTO PINTO.
ALAN WANZENBERG.",How can I make my own room online for free?,administrator D. Roomstyler. Ikea Home administrator Tools. Design a Room. Homestyler. The Home Renovator. Sweet Home D. SmartDraw.,What is the best free app for house plans?,SketchUp. Floorplanner. SmartDraw. Planner D. householdByMe. Roomstyler D household Planner. DFS room planner. Carpetright visualiser.,What is the best interior designing app?,"RoomScan Pro. How many hours have you spent searching for the original floor plan of your house? Houzz. Everyone's favourite interior design site, Houzz, also secure a superbly handy app. Havenly. Photo Measures. Planner D. Live Home D. SmartDraw. Vogue Living.",How can I do my own interior design?,"Make A Budget.
Create A Mood board.
Choose Your “Springboard"" (Inspiration) Object.
Make A Room Layout Plan.
Choose Foundation Furniture.
Pick enamel Colors.
Scale Up.
Don't Over-Source Any Single Source.",How can I draw my house plans for free online?,SketchUp. AutoCAD Architecture. Civil D. AutoCAD LT. SmartDraw. Sweet Home D. blueprint it. Floorplanner.
