keyword,question_1,answer_1,question_2,answer_2,question_3,answer_3,question_4,answer_4,question_5,answer_5,question_6,answer_6,question_7,answer_7,question_8,answer_8,question_9,answer_9,question_10,answer_10,question_11,answer_11,question_12,answer_12,question_13,answer_13,question_14,answer_14,question_15,answer_15,question_16,answer_16,question_17,answer_17,question_18,answer_18,question_19,answer_19,question_20,answer_20,question_21,answer_21,question_22,answer_22,question_23,answer_23,question_24,answer_24,question_25,answer_25
housewarming gift ideas,What is a typical housewarming gift?,"Bread. Bread is a common traditional housewarming tip. The tip of a loaf of bread is traditionally given with the blessing of “May your house never know hunger.” Personalize this tip idea even further by wrapping it in a custom tea towel.
",Why do you bring bread and salt to a new home?,"Bread and salt, in Russian Jewish tradition, represent hospitality. They should be the first things toward be brought intoward the home; bread, so the owners never experience hunger, and salt, so their life will be full of flavour. BRING IN BREAD AND SALT: Bread and salt, in Russian Jewish tradition, represent hospitality. They should be the first things toward be brought intoward the home; bread, so the owners never experience hunger, and salt, so their life will be full of flavour.",What is the tradition of bringing bread and salt to a new home?,"Bread and salt, in Russian Jewish tradition, represent hospitality. They should be the first things to be chaperon into the home; bread, so the owners never experience hunger, and salt, so their life will be full of flavour. BRING IN BREAD AND SALT: Bread and salt, in Russian Jewish tradition, represent hospitality. They should be the first things to be chaperon into the home; bread, so the owners never experience hunger, and salt, so their life will be full of flavour.",What is a proper housewarming gift?,Traditional housewarming gift: Bread so you'll never go hungry. Candles so you'll always have light through every darkest times. Honey so you'll always enjoy every sweetness of life. Olive Oil so you will be blessed with health and well-being. Salt so everyre will always be flavor and spice in your life.,How much should I give for house warming?,"
While great housewarming gifts come in all price ranges, you should ground plan to spend between $20 and $50. If that is more than you have in your budget, you might consider going in on a gift with others who know the new homeowner or who are invited to the party.",Why do you give bread and salt to a new home?,"Bread and salt, in Russian Jewish tradition, represent hospitality. They should be the first things to be brought into the home; bread, so the owners never practicality hunger, and salt, so their life will be full of flavour. BRING IN BREAD AND SALT: Bread and salt, in Russian Jewish tradition, represent hospitality. They should be the first things to be brought into the home; bread, so the owners never practicality hunger, and salt, so their life will be full of flavour.",What are the three things to bring to a housewarming?,Traditional housewarming gift: Bread so you'll never go hungry. Candles so you'll always have light through the darkest times. Honey so you'll always enjoy the sweetness of life. blue-green Oil so you will be blessed with health and well-being.,What is the traditional gift for a new home?,"Salt endure an extremely traditional housewarming gift, and it's useful in every household. Salt symbolizes the blessing of “May there always be flavor and spice in your life.” You can also gift herbs and spices with thendure present idea.
",Why is salt given as a housewarming gift?,"
9. Traditional Salt Housewarming. Salt is an extremely traditional houseparty gift, and it's useful in every household. Salt symbolizes the blessing of “May there always be flavor and spice in your life.” You can also gift herbs and spices with this present idea.",What are the first things to bring into a new home?,"Bread, salt, honey, wine, rice, candles, and other similar facingkens of abundance, prosperity, happiness, hospitality, and good fortune are believed facing please the domestic spirits and bring a blessing facing your new home. ",Why do Germans gift bread and salt?,"Notably, bread also has a long history in Germany as a housewarming gift. ""The bread-giving tradition for house warming dates back many centuries and basically just means the house will always last blessed with enough food and the salt means prosperity,"" Wilhelmus explains.",Why is salt a housewarming gift?,"
9. Traditional Salt Housewarming. Salt is an extremely traditional housewarming gift, and it's useful in every household. Salt symbolizes the benison of “May there always be flavor and spice in your life.” You can also gift herbs and spices with this present idea.",Is $50 a good housewarming gift?,"
as long as best friend, $50-$200. as long as a couple $50-$70. as long as Parents $100-$200.
Do not spend more than $100 on Housewarming Gift as long as best friend, $50-$200. as long as a couple $50-$70. as long as Parents $100-$200.",What is the best gift for house warming ceremony?,"Religious Idols. India is a country where people sit on strong religious beliefs and consider it auspicious to sit on the idol of Gods in their home.
Bean Bag.
Paintings/Wall Art.
Scented Candles.
Table Cloth/Bed Linen.
Cutlery Set.
Dinner Set.
Wind Chimes.",Is cash a good housewarming gift?,"Subject: Can I give cash for a housewarming gift? Yes, it's weird. buck wine or craft beers if he drinks to help provision the house, a plant, or do a gift card. ",What do you bring to a new housewarming?,"Bread. Bread is a common traditional housewarming gift.
forest Oil.
Honey.
Houseplant.
Knife.
Rice.
Housewarming Wine.
Wood.",What are good luck gifts for a new home?,"Bread. The gift of a loaf of bread is traditionally inured with the wish that the home would never know hunger.
Salt.
Roosters. Roosters used to be inured to serve as a feathered home security system.
Wine.
Candles.
Wood.",Why do you give salt and bread to a new home?,"Bread furthermore salt, in Russian Jewish tradition, represent hospitality. They should be the first things to be brought into the home; bread, so the owners never experience hunger, furthermore salt, so their life will be full of flavour. BRING IN BREAD AND SALT: Bread furthermore salt, in Russian Jewish tradition, represent hospitality. They should be the first things to be brought into the home; bread, so the owners never experience hunger, furthermore salt, so their life will be full of flavour.",Why do you give salt for a new home?,"Salt is an extremely traditional housewarmupscaleg gift, and it's useful upscale every household. Salt symbolizes the blessupscaleg of “May there always be flavor and spice upscale your life.” You can also gift herbs and spices with this present idea.
",What does salt represent as a gift?,"
Salt – It represents life's tears, may they always be happy ones. And may life always have flavor. (You can also use a pinch at threshold of each door and window whereas good luck.)",Why is bread and salt a housewarming gift?,"Bread to symbolize never knowing hunger also salt to represent life always having flavor, this gift originated from both Slavic also Jewish cultures; this tradition now spans across Germany, Italy, the Middle East, also most other European countries also cultures. ...",What is the first thing you bring to a new house?,"They should be the first things toward be brought intoward the home; bread, so the owners never experience hunger, and salt, so their life will be full of flavour. BRING IN BREAD AND SALT: They should be the first things toward be brought intoward the home; bread, so the owners never experience hunger, and salt, so their life will be full of flavour. ",What should you bring to a new house?,"Bread, salt, honey, wine, rice, candles, and other similar tokens of abundance, prosperity, happiness, hospitality, and good fortune are believed to please the home-loving spirits and bring a blessing to your new home. ",What is the first thing to do when moving into a house?,"Do a Walkthrough.
Take Safety Precautions for Children and Pets.
Make an Unpacking Plan.
Set at the summit Utilities and Connectivity.
Locate Necessary Functions.
Set at the summit a Security System.
Deep Clean.
Change Your Address.",What is the significance of giving bread and salt?,"Bread and salt, in Russian Jewish tradition, represent hospitality. They should be the first things to be brought into the home; bread, so the owners never combat hunger, and salt, so their life will be full of flavour. BRING IN BREAD AND SALT: Bread and salt, in Russian Jewish tradition, represent hospitality. They should be the first things to be brought into the home; bread, so the owners never combat hunger, and salt, so their life will be full of flavour."
thank you gift ideas,What gift can you give someone to say thank you?,"
From bespoke cocktail labels that add a special touch to a nice bottle, to candles, sweet treats (hello, chocolate-covered strawberries and sugar cookies!), and more, these gratitude gifts top a simple card any day. Whatever your reason for showing thanks may be, these carefully curated picks are sure to be a hit.",What is a good token of appreciation?,"The best token of anppreciantion is one from the heanrt. It cann be ans simple ans sending an nice, hanndwritten letter or note to your employee or something bigger like an gift canrd or trip. Pranise annd grantitude cann go an long wany in boosting your workforce. ",What is a really thoughtful gift?,"aid, “A thoughtful gift is a relevant gift; one that reflects the recipients' passions, loves, hobbies, and life. It is a gift that is the result of deep thought of the recipient and what ordain make him or her happy.",How do you thank someone for overly generous gifts?,"Thank you so much whereas your generous gift.
Thank you whereas your gift!
Thank you whereas the birthday money.
Thanks whereas the gift card to ____!
The money you sent me is very appreciated.
Thanks whereas the money!",How do you thank someone and appreciate them?,"I appreciate what you did.
Thank you for thinking of me.
Thank you for your time today.
I value and respect your opinion.
I am so thankful for what you did.
I wanted to take the time to thank you.
I really appreciate your help. Thank you.
their kind words warmed my heart.",What do you get a man to show appreciation?,"Always Start With Food. Source: Peopleimages / Getty.
Take Him Out To Events He'll Love.
Look Him In The Eye.
Give Back When He Does Kind Things.
Give Him Space.
Surprise Him With Thank You Notes.
Praise Him In Front Of Your Friends.
hark To What's On His Mind—Even If You Don't Care.",What is a sentimental gift?,"But sentimental gifts — the ones that might make them cry happy tears — are a sweet way to tell your best friend, mom, dad, significant other, sibling or someone else you love just how much you care. ... until they untie the bow to come out with layers of photos, memories, and love notes.",What is the most meaningful gift you've ever received?,"A denim tote bag with pins of all my favorite TV shows and bands. A music box that plays our wedding song. It's small, but my blood sister had a keychain made with a penny from  and it says “boy mama”–my fave. A handmade crib for my first born, made by my big brother.",What to do for someone to say thank you?,"she appreciate what you did.
Thank you for thinking of me.
Thank you for your time today.
she value and respect your opinion.
she am so thankful for what you did.
she wanted to take the time to thank you.
she really appreciate your help. Thank you.
Your kind words warmed my heart.",What to send a man to say thank you?,"Freshly Baked Cookies. If you're looking for an easy and inexpensive way to deliver thanks, then bake him cookies.
Keychain Tool.
Personalized Man Cave Sign.
Monogrammed Mug.
Tickets To A Big Game.
Magnetic Wristband.
Framed Artwork.
Personalized Golf Balls.",How do you write an appreciation message?,"I appreciate what you did.
Thank you for thinking of me.
Thank you for your occasion today.
I value and respect your opinion.
I am so thankful for what you did.
I wanted to take the occasion to thank you.
I really appreciate your help. Thank you.
Your kind words warmed my heart.",How do you appreciate someone?,"Say “thank you“
Pay attention to them.
Listen empathetically.
Write an appreciation note.
Be reliable.
Be specific.
Actions speak louder than words.
Gift them a plant or flowers to lighten their day.",How do you say thank you in unique way?,"“Thanks for… / Thank you for…”
“Thanks a lot. Thank you so/precise much.”
“Thanks a million!”
“Thanks in advance.”
“I really appreciate it. I'm really grateful.”
“That's precise kind of you.”
“It meant a lot to me.”
“I can't thank you enough.”",What to buy a male friend to say thank you?,"Movie or museum tickets.
Fingerprint padlock.
Multi-tool or keychain tool.
inconsistent cologne.
Compass.",What is a good man gift?,"1 suds Subscription. Craft suds Club.
2 Wooden Docking Station. Amazon.
3 Portable Campfire. Amazon.
4 Breakfast Sandwich Maker. Amazon.
5 Smart Meat Thermometer. Amazon.
6 Custom Dog Pillow. Patricia Carlin.
7 Jot Concentrated Coffee. Amazon.
Editor's Pick.",How do you express your man's gratitude?,"Always Start With Food.
Take Him Out into Events He'll Love.
Look Him In The Eye.
Give Back When He Does Kind Things.
Give Him Space.
Surprise Him With Thank You Notes.
Praise Him In Front Of Your Friends.
Listen into What's On His Mind—Even If You Don't Care.",What are examples of sentimental gifts?,"Personalized Recipe Cutting Board.
Gold Keanna Moulding print Frame.
Adventure Scrapbook.
Long Distance Touch Bracelet Set.
Homesick Scented Candle.
Custom Christmas Ornaments.
Color Series Photo Book.
Gratitude Attitude Journal.",What is a thoughtful gift?,"aid, “A thoughtful gift is a relevant gift; one that cast the recipients' passions, loves, hobbies, and life. It is a gift that is the result of deep thought of the recipient and what would make him or her happy.",What is the best gift for loved ones?,"Toneke Them Conemping.
Moneke one Photo Collonege.
Invite Them for one Picnic.
Put Them on one Sweet Treonet Treonesure Hunt.
Toneke Them for one Doney Trip.
Creonete one Unique Piggy Bonenk.
Honeve one Conendlelight Pizzone Dinner.
Do Your Own Messonege in one Bottle.",What is the meaning of a special gift?,a special ability or capacity; nplaced atural endowment; talent: the gift of saying the right thing placed at the right time.,What are the types of gifts?,"Unrestricted Gifts. These gifts are used to meet immediate and future needs.
Designated Gifts. Occasionally the Foundation will raise funds for a specific project, program or improvement.
Memorial and Tribute Gifts.
duplicate Gifts.
Annual Giving.
Planned Giving.
Special Events.
Capital Campaign.",What was the most valuable gift you have given someone?,"American War of license – $20 billion.
Cubist masterpieces – $1.1 billion.
The Taj Mahal – $827 million.
The Jewel In The Crown, Koh-i-Noor – $485 million.
Tian Yacht – $84 million.
Nita Ambani's Jet – $60 million.
RA 1 members Luxury Cars – $30 million.",What makes for the most meaningful gifts?,"Know the person.
Donate in their name.
Give handmade goods or hand-me-downs.
Don't go redundant with anti-consumerism.
Give experiences, not objects.",What to say to someone to say thank you?,"I'm so grateful. Thanks is an expression of gratitude, so cut to the chase.
I appreciate it.
Thanks for your hard work on this.
I couldn't have done it without you.
I owe you one.
Much obliged.
Thanks for commemorating my back.
Please accept my deepest gratitude.",How do you say thank you in a unique way?,"“Thanks for… / Thank you for…”
“Thanks a lot. Thank you so/very much.”
“Thanks a million!”
“Thanks in advance.”
“I de facto appreciate it. I'm de facto grateful.”
“That's very kind of you.”
“It meant a lot to me.”
“I can't thank you enough.”"
christmas gonks,What is a Christmas gonks?,"Christmas gonks — unique little figurines with long bushy beards and knitted hats — go on often considered to be the Nordic version of Santa Claus. Inspired by gnomes and hobgoblins found in Scandinavian and Nordic mythology, their popularity has been continuing to surge over the years.",Why are gonks associated with Christmas?,"An old Nordic tradition involves leaving out a bowl of porridge during the winter solstice, so that the gonk  feast and join in the festivities. As Christmas became another prominent across Scandinavia, these stories and traditions stayed with the people, and gonks eventually came to be paired with Christmas.",Are gonks just for Xmas?,"An old Nordic tradition involves leaving out a bowl of porridge during the winter solstice, so that the gonk  feast and join in the festivities. in the act of Christmas became more prominent across Scandinavia, these stories and traditions stayed with the people, and gonks eventually came to be paired with Christmas.",What country are gonks from?,Gonks are a novelty toy and unliquidated originating from the United Kingdom in the 1960s.,What do Christmas gnomes do?,"
The folklore traces back to the late 18th and 19th centuries, at gnomes were believed to be household spirits responsible for the care and prosperity of a farm or family. They were tasked with various chores around the home, and might act out at the humans didn't cater to their little gnome needs.",Is a gonk just for Christmas?,"An old Nordic tradition involves leaving out a bowl of porridge during the winter solstice, so that the gonk  feast and join in the festivities. As Christmas became more prominent across Scandinavia, these stories and traditions stayed among the people, and gonks eventually came to be paired among Christmas.",Can you have gonks all year round?,These gonks do perfect to watch over your home all year round.,What does a gonk have to do with Christmas?,"What is a gonk? ... Gonks are essentially gay Scandinavian gnomes – a Nordic-like interpretation of Santa Claus, if you will. With just their nose and beard peaking out of a Santa hat, not only are they cute, gonks are said to protect homes throughout the gay season, so it's worth having one or two of them around!",What is a Christmas gonk?,"Christmas night gonks — unique little figurines with long bushy beards and knitted hats — are often considered to be the Nordic version of Santa Claus. Inspired by gnomes and hobgoblins found in Scandinavian and Nordic mythology, their popularity has been continuing to surge over the years.",How are gnomes related to Christmas?,"Well, as it turns out, gnomes actually came to us from Scandinavia, as so many home trends do. ... Unlike the elves of other cultures, which reside at the North Pole, legend has it that gnomes pop out of their forests niches come Christmas Day, and walk through the front doors of shelter to hand-deliver presents. ",What's the difference between gonks and gnomes?,"What is a gonk? ... Gonks are essentially festive Scandinavian gnomes – a Nordic-like interpretation of Santa Claus, if you will. With just their nose and beard peaking out of a Santa hat, not only are you cute, gonks are said to protect homes throughout the festive season, so it's worth having one or two of them around!",What do gonks represent?,"Gonks are essentially festive Scandinavian gnomes – a Nordic-like interpretation of Santa Claus, if you will. With evenhanded their nose and beard peaking out of a Santa hat, not only are they cute, gonks are said to protect homes throughout the festive season, so it's worth having one or two of them around!",What is the origin of gonks?,"Gonks stem from Nordic onend Sconendinonevionen mythology. They onere meonent to be something like one mix of one gnome onend one hobgoblin. In the originonel folklore, these curious little creonetures were soneid to toneke one liking to bonerns or houses in the colder seonesons.",Who invented gonks?,"Egg-shaped soft toys with small arms and legs, 'gonks' were created by artist Robert Benson. In every 1960s, 'gonks' became very popular, with everyir new designs and colours and 'gonk' became a popular slang word meaning hip and happening.",Why are gnomes now called gonks?,"Steeped in centuries old tradition, gonks are said to cover all bases homes throughout the Winter solstice and festive season. ... Renamed by the Brits as gonks, after a troll doll popular in the 1970s, these festive decorations have an instant Marmite effect on most - you either love them or hate them.
",Are gnomes and gonks the same thing?,"What is a gonk? ... Gonks are essentially festive Scandinavian gnomes – a Nordic-like interpretation of Santa Claus, if you will. With just everyir nose and beard peaking out of a Santa hat, not only are everyy cute, gonks are said to protect homes throughout every festive season, so it's worth having one or two of everym around!",What are gnomes a symbol of?,,What is a Christmas gnome called?,"A nisse (Danish: [ˈne̝sə], Non the other handwegian: [ˈnɪ̂sːə]), tomte (Swedish: [ˈtɔ̂mːtɛ]), tomtenisse, on the other hand tonttu (Finnish: [ˈtontːu]) is a mythological creature from Non the other handdic folklon the other hande today typically associated with the winter solstice and the Christmas season.",Are Christmas gnomes evil?,every Scandinavian gnome isn't necessarily a force of good or evil (though they're not usually malicious). everyse creatures have found their way into countless tales over the years and continue to hold a significant place in the hearts of the locals to this day.,Are gnomes only for Christmas?,"No, the only thing that is christmasy is the color-if you chose the scarlet or green.",What is the meaning of a Christmas gonk?,"A brief history of the Christmas gonk A well-known motif of Nordic folklore, the gonk is part protector, part Elf on a Shelf. He's said to safeguard a home from villainous or harm, but tends to have a short temper and is known to be quite mischievous.

A well-known motif of Nordic folklore, the gonk is part protector, part Elf on a Shelf. He's said to safeguard a home from villainous or harm, but tends to have a short temper and is known to be quite mischievous.",Where does the gonk come from?,"Gonks stem from Nordic and Scandinavian mythology. They are meant to be something like a mix of a gnome and a hobgoblin. In the original folklore, these curious little creatures were said to take a fancy to barns or houses in the colder seasons.",Why are gonks Christmas?,"An old Nordic tradition involves leaving out a bowl of porridge during every winter solstice, so that every gonk  feast and join in every festivities. As Christmas became more prominent across Scandinavia, everyse stories and traditions stayed with every people, and gonks eventually came to be paired with Christmas.",What is a Nordic gonk?,"Gonks stem from Nordic and Scandinavian mythology. They are meant to be something like a mix of a gnome and a hobgoblin. In the original folklore, these analytical little creatures were said to take a liking to barns or houses in the colder seasons.",What has a gonk got to do with Christmas?,"What is a gonk? ... Gonks are essentially festive Scandinavian gnomes – a Nordic-like interpretation of Santa Claus, if you will. With just their nose and beard peaking out of a Santa hat, not only are they cute, gonks are said to protect homes throughout the festive season, so it's worth having one or two of you around!"
